filename,text
.\data\Client6\clips\common_voice_en_42713352.mp3,Wetmore's government helped finance extensions to rail lines in the province.
.\data\Client6\clips\common_voice_en_42713353.mp3,There may also be two isomers.
.\data\Client6\clips\common_voice_en_42713357.mp3,Steyr insisted on upgrading suspension components to suit European tastes.
.\data\Client6\clips\common_voice_en_42713358.mp3,"Chris Richards, of Q and Not U fame, helped with production."
.\data\Client6\clips\common_voice_en_42713359.mp3,"By facing challenges head-on, we demonstrate courage and resilience."
.\data\Client6\clips\common_voice_en_42713360.mp3,It may also be used for prevention of loiasis in those at high risk.
.\data\Client6\clips\common_voice_en_42713361.mp3,One example is the Windows Phone Synthesizer.
.\data\Client6\clips\common_voice_en_42713362.mp3,"She initially operated as a cross-channel ferry on the Weymouth, Dorset to Cherbourg route."
.\data\Client6\clips\common_voice_en_42713363.mp3,"When combined with endemic harassment, many sought to return to Mexico."
.\data\Client6\clips\common_voice_en_42713364.mp3,The couple had been the parents of eight children.
.\data\Client6\clips\common_voice_en_42713365.mp3,"He replied, I abused a person by calling his mother with bad names."
.\data\Client6\clips\common_voice_en_42713366.mp3,"A prison officer told Reed's mother, We deal with restraint and maintaining the law."
.\data\Client6\clips\common_voice_en_42713367.mp3,"Many hotels, restaurants, grocery stores and pharmacy are found alongside this road."
.\data\Client6\clips\common_voice_en_42713368.mp3,Nativity Rocks!
.\data\Client6\clips\common_voice_en_42713369.mp3,These islands have all been inhabited at one time or another.
.\data\Client6\clips\common_voice_en_42713371.mp3,Ray was married to Hashi.
.\data\Client6\clips\common_voice_en_42713373.mp3,"There’s a trunk-call from London, Sir Walter."
.\data\Client6\clips\common_voice_en_42713377.mp3,The unincorporated community of Soudan is located within Breitung Township.
.\data\Client6\clips\common_voice_en_42713378.mp3,His father died when Adams was still young.
.\data\Client6\clips\common_voice_en_42713379.mp3,"Hindoo is an archaic spelling variant, whose use today may be considered derogatory."
.\data\Client6\clips\common_voice_en_42713380.mp3,He was treated and returned to his work with the Oakland organization.
.\data\Client6\clips\common_voice_en_42713381.mp3,"He is known for his agility, slyness, and craftiness."
.\data\Client6\clips\common_voice_en_42713386.mp3,It was subsequently announced that he would serve as deputy leader of Veritas.
.\data\Client6\clips\common_voice_en_42713387.mp3,The tables are limited to clients that can participate in the current gnutella network.
.\data\Client6\clips\common_voice_en_42713388.mp3,"The World Meteorological Organization classifies most accessory clouds as ""supplementary features""."
.\data\Client6\clips\common_voice_en_42713389.mp3,This color is degraded by the presence of iron salts.
.\data\Client6\clips\common_voice_en_42713390.mp3,Kartes is married to Alexandra Goodman.
.\data\Client6\clips\common_voice_en_42713391.mp3,Patriots fans said that they had no natural hatred for the Giants.
.\data\Client6\clips\common_voice_en_42713392.mp3,The text does not provide enough information to determine whether Mr.
.\data\Client6\clips\common_voice_en_42713393.mp3,His opponent is Richman Rodriguez.
.\data\Client6\clips\common_voice_en_42713394.mp3,They have two daughters together: Florencia and Katia.
.\data\Client6\clips\common_voice_en_42713395.mp3,"In addition, he conducted his own acting classes."
.\data\Client6\clips\common_voice_en_42713400.mp3,Do you know how to add?
.\data\Client6\clips\common_voice_en_42713402.mp3,"He and his wife, Dorothy Inman Brown, had five children."
.\data\Client6\clips\common_voice_en_42713403.mp3,Wamsley is married to Rachel Wamsley and has two children.
.\data\Client6\clips\common_voice_en_42713404.mp3,One exception is purple sulfur bacteria.
.\data\Client6\clips\common_voice_en_42713405.mp3,"Auberlen was born in Redondo Beach, California, located in the Los Angeles metropolitan area."
.\data\Client6\clips\common_voice_en_42713406.mp3,"The centre offers professional coaching in soccer, netball, basketball and cricket."
.\data\Client6\clips\common_voice_en_42713408.mp3,I'm horrified to have any association with this school.
.\data\Client6\clips\common_voice_en_42713410.mp3,He drew sketches of each of the storeowners on his iPad.
.\data\Client6\clips\common_voice_en_42713412.mp3,When fifteen he entered the Upper School at Rugby.
.\data\Client6\clips\common_voice_en_42713413.mp3,"It is headquartered in Chepstow, Monmouthshire, Wales."
.\data\Client6\clips\common_voice_en_42713415.mp3,He is interred at his family's plot in the Toronto Necropolis Cemetery.
.\data\Client6\clips\common_voice_en_42713416.mp3,Valhalla is mostly text-based with some graphics showing the location and the characters there.
.\data\Client6\clips\common_voice_en_42713417.mp3,"New Iberia is the part of the Lafayette, Louisiana Metropolitan Statistical Area."
.\data\Client6\clips\common_voice_en_42713418.mp3,Yields are restricted to two tons per acre.
.\data\Client6\clips\common_voice_en_42713419.mp3,This is also in contrary motion.
.\data\Client6\clips\common_voice_en_42713420.mp3,The motives and orders of the pilot remain unanswered.
.\data\Client6\clips\common_voice_en_42713421.mp3,The lake is on Mexico Creek.
.\data\Client6\clips\common_voice_en_42713423.mp3,General Jehangir Karamat is the director and contributor to the Spearhead Research Institute.
.\data\Client6\clips\common_voice_en_42713425.mp3,The writing system was inherited from Bolgar.
.\data\Client6\clips\common_voice_en_42713427.mp3,Chaves County is a Republican stronghold.
.\data\Client6\clips\common_voice_en_42713430.mp3,"In the wake of the Sasebo slashing, three months later, this criticism was exacerbated."
.\data\Client6\clips\common_voice_en_42713431.mp3,The village's shop and post office have closed.
.\data\Client6\clips\common_voice_en_42713432.mp3,He said that doctors had cleared him to participate.
.\data\Client6\clips\common_voice_en_42713433.mp3,The artist Warren Kremer is closely associated with the publisher.
.\data\Client6\clips\common_voice_en_42713434.mp3,The nearest community college is Berkshire Community College in Pittsfield.
.\data\Client6\clips\common_voice_en_42713435.mp3,However the protection is reduced if the coating is cracked or otherwise damaged.
.\data\Client6\clips\common_voice_en_42713436.mp3,He was then hospitalised and spent a period of recovery in County Donegal.
.\data\Client6\clips\common_voice_en_42713438.mp3,These limits are numbers between which a catalytic converter is operating normally.
.\data\Client6\clips\common_voice_en_42713439.mp3,Their first language was Welsh.
.\data\Client6\clips\common_voice_en_42713441.mp3,The city is served by Arthur Siqueira Airport dedicated to general aviation.
.\data\Client6\clips\common_voice_en_42713444.mp3,The actual site of Go-Reizei's grave is known.
.\data\Client6\clips\common_voice_en_42713445.mp3,"Generally, however, this product energy is more destructive and dark."
.\data\Client6\clips\common_voice_en_42713446.mp3,"Together, the trio became The Full Blooded Italians."
.\data\Client6\clips\common_voice_en_42713447.mp3,"The Vagabonds, ""At Sea"", and ""Midsummer"" are among his best-known poems."
.\data\Client6\clips\common_voice_en_42713448.mp3,The mermaids sing happily over the unconscious prince.
.\data\Client6\clips\common_voice_en_42713449.mp3,"Gavan Duffy was considered largely ineffectual as a judge, let alone as Chief Justice."
.\data\Client6\clips\common_voice_en_42713450.mp3,The Olin Ski Company manufactured camping and skiing gear.
.\data\Client6\clips\common_voice_en_42713451.mp3,"However, not everyone struggled on the field."
.\data\Client6\clips\common_voice_en_42713452.mp3,The remains of these weighbridges rest in two slate wagons in the yard.
.\data\Client6\clips\common_voice_en_42713453.mp3,"Let ""D"" be a domain."
.\data\Client6\clips\common_voice_en_42713458.mp3,Ventro eventually merged with Nexprise.
.\data\Client6\clips\common_voice_en_42713459.mp3,"She was also the founder of the Southworth Library in Dryden, New York."
.\data\Client6\clips\common_voice_en_42713460.mp3,These 'Havaru' went to Thinadhoo and recaptured the island after much bloodshed.
.\data\Client6\clips\common_voice_en_42713462.mp3,Two compression ratios are significant.
.\data\Client6\clips\common_voice_en_42713463.mp3,They were the first equipment maker to take this approach.
.\data\Client6\clips\common_voice_en_42713464.mp3,It is a sub-prefecture of the Charente-Maritime department.
.\data\Client6\clips\common_voice_en_42713465.mp3,The canyon was the site of several battles during the American Old West.
.\data\Client6\clips\common_voice_en_42713466.mp3,Today they commonly go hunting or fishing with their fathers.
.\data\Client6\clips\common_voice_en_42713467.mp3,He then asked Edwin Lutyens to build him a castle.
.\data\Client6\clips\common_voice_en_42713469.mp3,Wise or otherwise eccentric aunts are also popular in works of fiction.
.\data\Client6\clips\common_voice_en_42713473.mp3,"After college, Jacoby went undrafted."
.\data\Client6\clips\common_voice_en_42713474.mp3,Golfers play at the course of the Rushworth Golf Club on Tatura Road.
.\data\Client6\clips\common_voice_en_42713475.mp3,The Boggy Bayou Mullet Festival is held annually in Niceville.
.\data\Client6\clips\common_voice_en_42713476.mp3,Free The Children's funding comes from young people.
.\data\Client6\clips\common_voice_en_42713477.mp3,An important commodity it produced was paddy.
.\data\Client6\clips\common_voice_en_42713478.mp3,Many on the island relished seal meat much more than pork.
.\data\Client6\clips\common_voice_en_42713479.mp3,Post-apartheid South African cities are probably the most visible example of this phenomenon.
.\data\Client6\clips\common_voice_en_42713480.mp3,There is some disagreement about the mass of this star in the literature.
.\data\Client6\clips\common_voice_en_42713481.mp3,Lincoln won a majority in the Electoral College.
.\data\Client6\clips\common_voice_en_42713482.mp3,There is a small crater along the exterior of the rim to the northeast.
.\data\Client6\clips\common_voice_en_42713613.mp3,He was replaced as Managing Editor by Trevor Dann.
.\data\Client6\clips\common_voice_en_42713614.mp3,Semisupervised approaches have been suggested to avoid part of the annotation effort.
.\data\Client6\clips\common_voice_en_42713615.mp3,The European Green Deal is part of it.
.\data\Client6\clips\common_voice_en_42713616.mp3,Float switches must be clear of any obstructions within the sump.
.\data\Client6\clips\common_voice_en_42713617.mp3,But the gay scenes are unclear outside Tallinn and Tartu.
.\data\Client6\clips\common_voice_en_42713883.mp3,Much of the cathedral's present appearance is a result of this renovation.
.\data\Client6\clips\common_voice_en_42713884.mp3,A small white spot is found at the nape of the neck.
.\data\Client6\clips\common_voice_en_42713885.mp3,It was initially contested on a course with a sharp left-hand bend.
.\data\Client6\clips\common_voice_en_42713886.mp3,"The crest was an elephant, and the motto ""Per laborem ad honorem""."
.\data\Client6\clips\common_voice_en_42713887.mp3,The normal age to celebrate this was fourteen years.
.\data\Client6\clips\common_voice_en_42713888.mp3,This is achieved by doubling the strings for individual notes.
.\data\Client6\clips\common_voice_en_42713889.mp3,That's why we are so good at war!
.\data\Client6\clips\common_voice_en_42713891.mp3,"If both sides score the same number of runs, the match is tied."
.\data\Client6\clips\common_voice_en_42713892.mp3,Most of the river course runs over hilly landscape with tall banks.
.\data\Client6\clips\common_voice_en_42713894.mp3,"For example, ""I love to cook elaborate meals for my family."""
.\data\Client6\clips\common_voice_en_42713895.mp3,His interest in components grew out of his experience with radar.
.\data\Client6\clips\common_voice_en_42713896.mp3,They offer some of the new corn to their dead ancestors.
.\data\Client6\clips\common_voice_en_42713897.mp3,Sleeping trains in Poland are run by Intercity company.
.\data\Client6\clips\common_voice_en_42713898.mp3,"Troops who were to be demobilised mutinied, launching attacks in several cities."
.\data\Client6\clips\common_voice_en_42713899.mp3,"He asks Betsy if she would consider euthanasia, but she refuses."
.\data\Client6\clips\common_voice_en_42713900.mp3,The loch is popular with anglers.
.\data\Client6\clips\common_voice_en_42713901.mp3,"He paused, and Mr. Weller snuffed the candle."
.\data\Client6\clips\common_voice_en_42713902.mp3,Uintatherium was a large browsing animal.
.\data\Client6\clips\common_voice_en_42713926.mp3,Scioscia used the same catcher's mitt for most of his playing career.
.\data\Client6\clips\common_voice_en_42714011.mp3,This method is more common during the larval stages.
.\data\Client6\clips\common_voice_en_42714012.mp3,"Fielding practice again tomorrow, he said briskly, ""at six."""
.\data\Client6\clips\common_voice_en_42714013.mp3,Other businesses began to develop.
.\data\Client6\clips\common_voice_en_42714014.mp3,Labrisomids are shy fish and will retreat into crevices if threatened.
.\data\Client6\clips\common_voice_en_42714015.mp3,"Today, all of the branches of the Mucciolo family are still considered nobility."
.\data\Client6\clips\common_voice_en_42715077.mp3,I did not think it was of material importance.
.\data\Client6\clips\common_voice_en_42715078.mp3,Volga is the producer of the show.
.\data\Client6\clips\common_voice_en_42715079.mp3,"Commonly, flanging is referred to as having a ""jet plane-like"" characteristic."
.\data\Client6\clips\common_voice_en_42715080.mp3,The cards on the tableau are built down in alternating colors.
.\data\Client6\clips\common_voice_en_42715081.mp3,Kathmandu Metal Industries Pvt.
.\data\Client6\clips\common_voice_en_42715082.mp3,"The Scarsdale Inquirer, a weekly newspaper, reports on local issues."
.\data\Client6\clips\common_voice_en_42715083.mp3,He won the audition over Rafael Fuentes much to his dismay.
.\data\Client6\clips\common_voice_en_42715084.mp3,It was Norodom's prestige that ultimately brought Si Votha's resistance to an end.
.\data\Client6\clips\common_voice_en_42715085.mp3,The following list indicates some of her work.
.\data\Client6\clips\common_voice_en_42715086.mp3,Other population centers include: Couvreux and Montquintin.
.\data\Client6\clips\common_voice_en_42715967.mp3,It would be illuminated at night.
.\data\Client6\clips\common_voice_en_42715968.mp3,Multiple local bus lines form the city transportation system.
.\data\Client6\clips\common_voice_en_42715969.mp3,It is northeast of Tyrone and southwest of Bald Eagle.
.\data\Client6\clips\common_voice_en_42715970.mp3,Pisciculture has made significant advances in the state.
.\data\Client6\clips\common_voice_en_42715971.mp3,"However, other circumstances may also determine the use of a championship."
.\data\Client6\clips\common_voice_en_42716184.mp3,"The Netherlands won the group, by beating France in their last group match."
.\data\Client6\clips\common_voice_en_42716185.mp3,"Other regionally used alternatives include the Stampian, Tongrian, Latdorfian and Vicksburgian."
.\data\Client6\clips\common_voice_en_42716186.mp3,He was associated with the Greek church San Giorgio dei Greci in Venice.
.\data\Client6\clips\common_voice_en_42716187.mp3,Post war he served in the Canadian navy for some time.
.\data\Client6\clips\common_voice_en_42716188.mp3,"The Latin motto ""Deo Confidimus"" at the base translates as ""In God We Trust""."
.\data\Client6\clips\common_voice_en_42716189.mp3,The demonstrators demanded the end of the Syrian influence in Lebanese politics.
.\data\Client6\clips\common_voice_en_42716190.mp3,Her research considers free radical reactions.
.\data\Client6\clips\common_voice_en_42716191.mp3,"DeCandido described the boxing scene where Sisko punches Q as ""wonderful"" and ""spectacular""."
.\data\Client6\clips\common_voice_en_42716192.mp3,All six are members of the Labour Party.
.\data\Client6\clips\common_voice_en_42716193.mp3,He studied art at Iowa State University.
.\data\Client6\clips\common_voice_en_42716207.mp3,Nactins have no known medical use.
.\data\Client6\clips\common_voice_en_42716209.mp3,The mark I boat was an off the shelf design built by Tiger Marine.
.\data\Client6\clips\common_voice_en_42716210.mp3,"Nyswaner was born in Clarksville, Pennsylvania."
.\data\Client6\clips\common_voice_en_42716211.mp3,"Davis wrote that ""a song is worth a thousand harangues""."
.\data\Client6\clips\common_voice_en_42716213.mp3,Each member of the panel can only vote for one contestant from the trio.
.\data\Client6\clips\common_voice_en_42716214.mp3,A dining car was available only on some of the trains.
.\data\Client6\clips\common_voice_en_42716215.mp3,They performed at American Club and Marine House in Kathmandu.
.\data\Client6\clips\common_voice_en_42716216.mp3,He now has the title of conductor laureate with the orchestra.
.\data\Client6\clips\common_voice_en_42716217.mp3,"Gill lives in Brentwood, Tennessee and has two sons, Patrick and Ryan."
.\data\Client6\clips\common_voice_en_42716218.mp3,Braga was the first Brazilian to present a category at the Oscars.
.\data\Client6\clips\common_voice_en_42717631.mp3,The door closed behind Alfie and himself.
.\data\Client6\clips\common_voice_en_42717632.mp3,The words were never repeated in the track again.
.\data\Client6\clips\common_voice_en_42717633.mp3,"Zaum activities included public gatherings, demonstrations, and publications."
.\data\Client6\clips\common_voice_en_42717634.mp3,Cremers was active as an author and illustrator.
.\data\Client6\clips\common_voice_en_42717635.mp3,"It is the last ""Quercus"" genus species to disappear when rainfall is lacking."
.\data\Client6\clips\common_voice_en_42717982.mp3,The gods are honoured and always asked for help.
.\data\Client6\clips\common_voice_en_42718087.mp3,"Karyn Bosnak was born in Chicago, Illinois."
.\data\Client6\clips\common_voice_en_42718088.mp3,"Houghton's extravagance, which went far beyond his salary, made him an obvious suspect."
.\data\Client6\clips\common_voice_en_42718089.mp3,It is affiliated with Saint Stephens Church in Twickenham and regularly hold events there.
.\data\Client6\clips\common_voice_en_42718090.mp3,A large number of these are widely recognised and used by Australian English speakers.
.\data\Client6\clips\common_voice_en_42718091.mp3,"When released on that compilation album, it earned gold discs abroad."
.\data\Client6\clips\common_voice_en_42718243.mp3,His reign was short.
.\data\Client6\clips\common_voice_en_42718307.mp3,The quiz attracts participants from a small band of diehard quizzers across the world.
.\data\Client6\clips\common_voice_en_42718308.mp3,This was the first high school affiliated with the Solomon Schechter Day School Association.
.\data\Client6\clips\common_voice_en_42718309.mp3,"An episode of ""Lassie"" was also filmed in this part of the cave."
.\data\Client6\clips\common_voice_en_42718310.mp3,He just acts on them with more intensity than we do.
.\data\Client6\clips\common_voice_en_42718311.mp3,"He has directed several episodes of the Showtime series ""Nurse Jackie""."
.\data\Client6\clips\common_voice_en_42718347.mp3,"Its official title is ""The History of California""."
.\data\Client6\clips\common_voice_en_42718348.mp3,The bank was renamed Standard Bank Malawi.
.\data\Client6\clips\common_voice_en_42718349.mp3,Two members of the patrol were captured.
.\data\Client6\clips\common_voice_en_42718350.mp3,Crito relays bad news to Socrates.
.\data\Client6\clips\common_voice_en_42718351.mp3,The host species of this moth are unknown.
.\data\Client6\clips\common_voice_en_42718526.mp3,Now it is unblocked.
.\data\Client6\clips\common_voice_en_42718527.mp3,The constituency covers the area around Great Yarmouth in Norfolk.
.\data\Client6\clips\common_voice_en_42718528.mp3,Hicks decided at an early age that she wished to be an engineer.
.\data\Client6\clips\common_voice_en_42718529.mp3,She is divorced from actor Tom Sizemore.
.\data\Client6\clips\common_voice_en_42718530.mp3,Then he took that film again to the Ludwigshafen Film Congress
.\data\Client6\clips\common_voice_en_42719767.mp3,He locks himself in a room to finish making Mina his bride.
.\data\Client6\clips\common_voice_en_42720844.mp3,"Devil's Due is written by Mike Carey, with pencils by Salvador Larroca."
.\data\Client6\clips\common_voice_en_42720845.mp3,Funerals are libations are poured.
.\data\Client6\clips\common_voice_en_42720846.mp3,"Melton is located on flat, largely featureless, former volcanic plains."
.\data\Client6\clips\common_voice_en_42720847.mp3,The cross crosslets came from the arms of the Diocese of Canterbury.
.\data\Client6\clips\common_voice_en_42720849.mp3,The band prefers the intimacy of smaller clubs and live appearances are sporadic.
.\data\Client6\clips\common_voice_en_42721234.mp3,All featured ornamental birds designed by Irish artist Gabriel Hayes on the reverse.
.\data\Client6\clips\common_voice_en_42721235.mp3,Country codes are dialed before the national telephone number.
.\data\Client6\clips\common_voice_en_42721236.mp3,Haines is one of the northern stops on the Alaska Marine Highway.
.\data\Client6\clips\common_voice_en_42721237.mp3,"Unless otherwise specified, stories were presented in the form of re-enactments."
.\data\Client6\clips\common_voice_en_42721238.mp3,Diagnosis is typically based on the symptoms.
.\data\Client6\clips\common_voice_en_42721239.mp3,"The basis case is correct, but the induction step has a fundamental flaw."
.\data\Client6\clips\common_voice_en_42721240.mp3,The footnote reads: ...
.\data\Client6\clips\common_voice_en_42721241.mp3,She is the cousin of her Queensland teammate Ellie Johnston.
.\data\Client6\clips\common_voice_en_42721242.mp3,"Your health, sir."
.\data\Client6\clips\common_voice_en_42721243.mp3,The districts of Kurunegala and Puttalam formulate Wayamba.
.\data\Client6\clips\common_voice_en_42721513.mp3,The cyclic rate can be altered by installing different bolts and recoil springs.
.\data\Client6\clips\common_voice_en_42721514.mp3,"Everyone was boarded onto ""Deliverance"" and ""Patience,"" which set sail for England."
.\data\Client6\clips\common_voice_en_42722071.mp3,"In German, all relative clauses are marked with commas."
.\data\Client6\clips\common_voice_en_42722149.mp3,He was for many years barrack master in New York.
.\data\Client6\clips\common_voice_en_42722150.mp3,The word -holm stands for little island.
.\data\Client6\clips\common_voice_en_42722151.mp3,He was used as a guinea pig for Doctor Geiger's experiments.
.\data\Client6\clips\common_voice_en_42722152.mp3,"Experiments indicate that the transition is second-order, meaning there is no latent heat."
.\data\Client6\clips\common_voice_en_42722153.mp3,"Early missionaries pioneered in China, Japan, South Africa, Mongolia, India and South America."
.\data\Client6\clips\common_voice_en_42722281.mp3,"The first residents were immigrants, some of whom were Holocaust survivors."
.\data\Client6\clips\common_voice_en_42722282.mp3,Northwestern College has the most tournament championship game appearances with six.
.\data\Client6\clips\common_voice_en_42722283.mp3,A program may also trigger an interrupt to the operating system.
.\data\Client6\clips\common_voice_en_42722284.mp3,This cab can be fitted with an add-on armour kit.
.\data\Client6\clips\common_voice_en_42722285.mp3,The prize is divided equally between author and publisher.
.\data\Client6\clips\common_voice_en_42722399.mp3,Westrup was eligible to play for Scotland because her mother was born there.
.\data\Client6\clips\common_voice_en_42722400.mp3,"Therefore, the reciprocal lattice is also a Bravais lattice."
.\data\Client6\clips\common_voice_en_42722401.mp3,"In terms of floristic provinces, it is represented by the Madrean Region."
.\data\Client6\clips\common_voice_en_42722402.mp3,They went on to purchase the nearby Sea Lion Park.
.\data\Client6\clips\common_voice_en_42722403.mp3,He is Professor of Contemporary Philosophy at the University of Barcelona.
.\data\Client6\clips\common_voice_en_42722413.mp3,The executive management team is led by Chief Executive Officer Doctor Bernard Leduc.
.\data\Client6\clips\common_voice_en_42722414.mp3,"He was born in Blackburn, Lancashire, England."
.\data\Client6\clips\common_voice_en_42722415.mp3,"Upon his return, Bartlebooth spends his time solving each jigsaw, re-creating the scene."
.\data\Client6\clips\common_voice_en_42722416.mp3,These partisan units also fought against the nationalist Ukrainian Insurgent Army.
.\data\Client6\clips\common_voice_en_42722418.mp3,Storage in amber-colored bottles can help to minimize light exposure.
.\data\Client6\clips\common_voice_en_42722671.mp3,The contrast is between his ubiquity and constant presence in different activities.
.\data\Client6\clips\common_voice_en_42722672.mp3,Players agree the stake to be played for at the start of the game.
.\data\Client6\clips\common_voice_en_42722673.mp3,The Philippine Postal Corporation manages one post office situated in the municipal building.
.\data\Client6\clips\common_voice_en_42722674.mp3,The local cinema club ensured its continued existence.
.\data\Client6\clips\common_voice_en_42722675.mp3,The police opened fire on him as he left and wounded him.
.\data\Client6\clips\common_voice_en_42722705.mp3,Construction was designed to enlarge and modernize the structures.
