filename,text
.\data\Client6\clips\common_voice_en_42706517.mp3,Its administrative centre was Cherepovets.
.\data\Client6\clips\common_voice_en_42706992.mp3,It sought to inform others about slavery and to help black freedom seekers.
.\data\Client6\clips\common_voice_en_42706993.mp3,Aragorn sailed the fleet to Minas Tirith to relieve the siege of the city.
.\data\Client6\clips\common_voice_en_42706994.mp3,It comprised three pairs of gates as stipulated in the act.
.\data\Client6\clips\common_voice_en_42706995.mp3,"Hartley's body was recovered by the ""Mackay-Bennett"" almost two weeks after the sinking."
.\data\Client6\clips\common_voice_en_42706996.mp3,It also helps me improve my vocabulary and communication skills.
.\data\Client6\clips\common_voice_en_42706997.mp3,Occasionally the salt is also toasted.
.\data\Client6\clips\common_voice_en_42706999.mp3,Built by Glasgow Corporation it is the continuing headquarters of Glasgow City Council.
.\data\Client6\clips\common_voice_en_42707000.mp3,"Born in Russell, Manitoba, Alexander was educated at the University of Manitoba."
.\data\Client6\clips\common_voice_en_42707001.mp3,It is situated between Darlington and Stockton-on-Tees.
.\data\Client6\clips\common_voice_en_42707027.mp3,Later the pair served the Seattle-Vashon Island route.
.\data\Client6\clips\common_voice_en_42707028.mp3,"She attended Limestone College in Gaffney, South Carolina."
.\data\Client6\clips\common_voice_en_42707029.mp3,"Rhesus monkeys were trained to self-administer cocaine or phencyclidine, then were offered dizocilpine instead."
.\data\Client6\clips\common_voice_en_42707030.mp3,God bless you for your kindness.
.\data\Client6\clips\common_voice_en_42707031.mp3,Consideration of the Schreber case led Freud to revise received classification of mental disturbances.
.\data\Client6\clips\common_voice_en_42707047.mp3,"Medication for asthma, croup, cystic fibrosis and some other conditions."
.\data\Client6\clips\common_voice_en_42707048.mp3,"Variety program ""Big Night Out"" was an ""In Melbourne Tonight"" style production."
.\data\Client6\clips\common_voice_en_42707049.mp3,His research primarily focused on the history of Sylhet.
.\data\Client6\clips\common_voice_en_42707050.mp3,It may also refer to a political or political science theory.
.\data\Client6\clips\common_voice_en_42707051.mp3,Frye Island is to the south in Sebago Lake.
.\data\Client6\clips\common_voice_en_42707473.mp3,Rapporteur of the Committee is Honorable Symon V Kaunda of Malawi.
.\data\Client6\clips\common_voice_en_42707474.mp3,Heiden is married to Jane Heiden with five children.
.\data\Client6\clips\common_voice_en_42707475.mp3,"The binomial name derives from the Latin words ""turdus"", ""thrush"", and ""ile"" ""flank""."
.\data\Client6\clips\common_voice_en_42707476.mp3,Trickett had used the then new invention of swivel rowlocks.
.\data\Client6\clips\common_voice_en_42707477.mp3,"It was felt as far away as Reno, Nevada."
.\data\Client6\clips\common_voice_en_42707662.mp3,"In people with treatment-refractory psychosis, a clozapine trial should be considered."
.\data\Client6\clips\common_voice_en_42708022.mp3,There were several strands of influences that affected this movement.
.\data\Client6\clips\common_voice_en_42708593.mp3,The band released the vinyl-only single Where Did Our Loving Go?
.\data\Client6\clips\common_voice_en_42708594.mp3,There are five to ten radical pinnately nerved leaves.
.\data\Client6\clips\common_voice_en_42708897.mp3,Morse is married and has three children.
.\data\Client6\clips\common_voice_en_42708898.mp3,Vertex is feebly depressed at middle.
.\data\Client6\clips\common_voice_en_42708899.mp3,They often perform with the in works for choir and orchestra.
.\data\Client6\clips\common_voice_en_42708900.mp3,"Sexes are similar, although females may be somewhat paler."
.\data\Client6\clips\common_voice_en_42708901.mp3,Team Bath reached the final but lost to Loughborough Lightning.
.\data\Client6\clips\common_voice_en_42709327.mp3,"Finally, the ""lace"" dashiki suit includes a shirt made of lace."
.\data\Client6\clips\common_voice_en_42709328.mp3,It starred Susan Hampshire and Nigel Davenport as Joy and George Adamson.
.\data\Client6\clips\common_voice_en_42709329.mp3,"On reaching Emmaus, they ask the stranger to join them for the evening meal."
.\data\Client6\clips\common_voice_en_42709330.mp3,Darwin also visited the saltpeter works.
.\data\Client6\clips\common_voice_en_42709332.mp3,"If one was overtaken, he and his companion were condemned to ""hell""."
.\data\Client6\clips\common_voice_en_42710088.mp3,Three month later Leningrad was officially renamed Saint Petersburg.
.\data\Client6\clips\common_voice_en_42710089.mp3,I speak nothing but the truth.
.\data\Client6\clips\common_voice_en_42710090.mp3,Publications that deviate from the official script are automatically censored.
.\data\Client6\clips\common_voice_en_42710091.mp3,They are formed by the contributions of passing travelers.
.\data\Client6\clips\common_voice_en_42710092.mp3,"Instead, pilot Heinrich Gerlach flew in a ""Storch""."
.\data\Client6\clips\common_voice_en_42710397.mp3,And to be kept back on such a motive!
.\data\Client6\clips\common_voice_en_42710398.mp3,Results have varied over the years.
.\data\Client6\clips\common_voice_en_42710399.mp3,The industrial capacity is very small.
.\data\Client6\clips\common_voice_en_42710400.mp3,The legs are short and black as well.
.\data\Client6\clips\common_voice_en_42710401.mp3,"However, the rules of competition can sometimes work the opposite direction."
.\data\Client6\clips\common_voice_en_42710427.mp3,I don’t intend to get killed if I can help it.
.\data\Client6\clips\common_voice_en_42710428.mp3,"Gentlemen, raise your leading tones!"
.\data\Client6\clips\common_voice_en_42710429.mp3,Betong Division contains two administrative districts: Betong and Saratok.
.\data\Client6\clips\common_voice_en_42710430.mp3,I learned this from my friend W. Robertson Smith.
.\data\Client6\clips\common_voice_en_42710431.mp3,After a re-run they dead heated again.
.\data\Client6\clips\common_voice_en_42710437.mp3,Knittel was founded in Maxfield Township.
.\data\Client6\clips\common_voice_en_42710438.mp3,Her brother is Swedish curler Joakim Flyg.
.\data\Client6\clips\common_voice_en_42710439.mp3,He spent the following three seasons with the New Orleans–St.
.\data\Client6\clips\common_voice_en_42710440.mp3,Critics disagree over the genre of the novel.
.\data\Client6\clips\common_voice_en_42710441.mp3,"Ray, too, had the option of playing football, but passed it up for baseball."
.\data\Client6\clips\common_voice_en_42710447.mp3,The winning team becomes the champion of Asia.
.\data\Client6\clips\common_voice_en_42710448.mp3,There was no concrete evidence available at the time for this.
.\data\Client6\clips\common_voice_en_42710449.mp3,"His son, Luke Pinches, also competes in professional snooker tournaments."
.\data\Client6\clips\common_voice_en_42710450.mp3,Most agents are not working for the distribution service.
.\data\Client6\clips\common_voice_en_42710451.mp3,Bartlett distinguished himself in this capacity and received Joint Service Commendation Medal.
.\data\Client6\clips\common_voice_en_42710452.mp3,Her family was involved in the textile industry.
.\data\Client6\clips\common_voice_en_42710453.mp3,Tommy was on-hand for the festivities.
.\data\Client6\clips\common_voice_en_42710454.mp3,He took an eight-minute flight over the Swiss Alps.
.\data\Client6\clips\common_voice_en_42710455.mp3,The top two scorers then competed for the title of City Champion.
.\data\Client6\clips\common_voice_en_42710456.mp3,She remained very private and shunned the limelight.
.\data\Client6\clips\common_voice_en_42710457.mp3,The nearest primary and secondary schools are in neighbouring Gayndah.
.\data\Client6\clips\common_voice_en_42710458.mp3,"Along with Marlon, Shawn Wayans created and starred in the sitcom ""The Wayans Bros""."
.\data\Client6\clips\common_voice_en_42710459.mp3,"The show was a one-time affair, and no further touring followed."
.\data\Client6\clips\common_voice_en_42710460.mp3,Gwenddoleu was defeated and killed.
.\data\Client6\clips\common_voice_en_42710461.mp3,Gameplay included arcade-style action and the management aspect of the sport.
.\data\Client6\clips\common_voice_en_42710462.mp3,"Males may have a distinct pale ""chevron"" patterns on their backs."
.\data\Client6\clips\common_voice_en_42710463.mp3,"'If you make peaceful revolution impossible, you make violent revolution inevitable."
.\data\Client6\clips\common_voice_en_42710464.mp3,Problems arise when Sasha is insulted in the school's newspaper column.
.\data\Client6\clips\common_voice_en_42710465.mp3,"After leaving the town, it crosses over the Leeds and Liverpool Canal in Lydiate."
.\data\Client6\clips\common_voice_en_42710466.mp3,"Well, what's your news?"
.\data\Client6\clips\common_voice_en_42710482.mp3,Four armchairs with built-in speakers play Handel's music.
.\data\Client6\clips\common_voice_en_42710483.mp3,It was designed like an Egyptian obelisk with three tiers.
.\data\Client6\clips\common_voice_en_42710484.mp3,"Indeed, there are more than a dozen bishops documented in Utica."
.\data\Client6\clips\common_voice_en_42710485.mp3,"Two days later, his successor Sir John Kerr was sworn in."
.\data\Client6\clips\common_voice_en_42710486.mp3,"She was the lead ship of her class, which were nicknamed the ""Splendid Cats""."
.\data\Client6\clips\common_voice_en_42710487.mp3,Over the years they migrated up through present-day Ohio and into Wisconsin.
.\data\Client6\clips\common_voice_en_42710488.mp3,With it the number of residents grew.
.\data\Client6\clips\common_voice_en_42710489.mp3,"'If you make peaceful revolution impossible, you make violent revolution inevitable."
.\data\Client6\clips\common_voice_en_42710490.mp3,Topics vary from year to year.
.\data\Client6\clips\common_voice_en_42710491.mp3,"This surname is mostly found in Palestine, Lebanon, Syria, Algeria, and Tunisia."
.\data\Client6\clips\common_voice_en_42710492.mp3,He died at Dumfries.
.\data\Client6\clips\common_voice_en_42710493.mp3,There is no statute of limitations for criminal child sex abuse in Maryland.
.\data\Client6\clips\common_voice_en_42710494.mp3,It also incorporated ornamental bricks and plain varnished woodwork.
.\data\Client6\clips\common_voice_en_42710495.mp3,"The inhabitants of the department are called ""Charentais""."
.\data\Client6\clips\common_voice_en_42710496.mp3,Simon Benson had wished to build a world-class hotel in Portland.
.\data\Client6\clips\common_voice_en_42710497.mp3,The interior is frescoed.
.\data\Client6\clips\common_voice_en_42710498.mp3,That's what Field was so keen on.
.\data\Client6\clips\common_voice_en_42710499.mp3,Ali was later sacked.
.\data\Client6\clips\common_voice_en_42710500.mp3,This infused new life into the quiet community.
.\data\Client6\clips\common_voice_en_42710501.mp3,There is widespread disagreement about what constitutes sprawl and how to quantify it.
.\data\Client6\clips\common_voice_en_42710502.mp3,"Get me a cab, he commanded, feeling in his pockets."
.\data\Client6\clips\common_voice_en_42710503.mp3,"For diabetics, glycemic load is a highly recommended tool for managing blood sugar."
.\data\Client6\clips\common_voice_en_42710504.mp3,The organization continues today as a public foundation reporting annually to Congress.
.\data\Client6\clips\common_voice_en_42710505.mp3,Al Ahly reached the final but lost.
.\data\Client6\clips\common_voice_en_42710506.mp3,The two-lane road also intersects a few driveways to residences.
.\data\Client6\clips\common_voice_en_42710507.mp3,During this period he attended the University of the Witwatersrand.
.\data\Client6\clips\common_voice_en_42710508.mp3,He had previously worked as a postman and a sixth-grade teacher.
.\data\Client6\clips\common_voice_en_42710509.mp3,It helps focus on the subject and not its environment.
.\data\Client6\clips\common_voice_en_42710510.mp3,It is difficult to regard the coincidence as purely accidental.
.\data\Client6\clips\common_voice_en_42710511.mp3,Cover was made by Nico and Theresa.
.\data\Client6\clips\common_voice_en_42710512.mp3,"It is also known as ""Hutchinson's melanotic freckle""."
.\data\Client6\clips\common_voice_en_42710513.mp3,"Born in Surrey, England, he studied at the University of London."
.\data\Client6\clips\common_voice_en_42710514.mp3,He was among the few professional military personnel at independence.
.\data\Client6\clips\common_voice_en_42710515.mp3,"Carmen, who's true to her instincts, represents everything he tries to repress."
.\data\Client6\clips\common_voice_en_42710516.mp3,"Saint Helena, Ascension Island and Tristan da Cunha comprise one British Overseas Territory."
.\data\Client6\clips\common_voice_en_42710517.mp3,"The course being optional, few people attend."
.\data\Client6\clips\common_voice_en_42710518.mp3,"Bilateral basal crackles also refers to the presence of ""basal"" crackles in both lungs."
.\data\Client6\clips\common_voice_en_42710519.mp3,"Diffusion of heat takes place in rigid solids, but that is called heat conduction."
.\data\Client6\clips\common_voice_en_42710520.mp3,There's a barn just before you get to them.
.\data\Client6\clips\common_voice_en_42710521.mp3,The film has musical score by Chellapilla Satyam.
.\data\Client6\clips\common_voice_en_42710522.mp3,The school is located at Park View High School in Sterling.
.\data\Client6\clips\common_voice_en_42710523.mp3,At the same time an underground extension to the Archives building were constructed.
.\data\Client6\clips\common_voice_en_42710524.mp3,It is also a Regional Member of the Round Square Conference of Schools.
.\data\Client6\clips\common_voice_en_42710525.mp3,His father was a school master at Netherthorpe Grammar School in Staveley.
.\data\Client6\clips\common_voice_en_42710526.mp3,"Conflict arose, however, between amateur and professional interests."
.\data\Client6\clips\common_voice_en_42710527.mp3,Hamster wheels allow rodents to run even when their space is confined.
.\data\Client6\clips\common_voice_en_42710528.mp3,Ovid M. Butler in command.
.\data\Client6\clips\common_voice_en_42710529.mp3,They will typically spawn at the first light of day.
.\data\Client6\clips\common_voice_en_42710530.mp3,Then there are different versions of the following events.
.\data\Client6\clips\common_voice_en_42710531.mp3,"Since retiring from playing, Bichel has been a coach and a selector."
.\data\Client6\clips\common_voice_en_42710532.mp3,"Eventually this role was delegated to an ""umpire""."
.\data\Client6\clips\common_voice_en_42710533.mp3,Approximately twenty three thousand people died and seventy seven thousands were gravely injured.
.\data\Client6\clips\common_voice_en_42710534.mp3,Another encourages keeping such a bun for medicinal purposes.
.\data\Client6\clips\common_voice_en_42710535.mp3,New Galloway today is an attractive rural town.
.\data\Client6\clips\common_voice_en_42710536.mp3,"Each consists of independent scientific institutes, laboratories and other sections."
.\data\Client6\clips\common_voice_en_42710537.mp3,He is famous for his invention of the first commercially used steam powered engine.
.\data\Client6\clips\common_voice_en_42710538.mp3,Throughout the brain the placement of these neurons are normally quite precise.
.\data\Client6\clips\common_voice_en_42710539.mp3,The early history of Wyandanch was mainly agricultural.
.\data\Client6\clips\common_voice_en_42710540.mp3,"His son, Morton F. Meads, was to succeed but was deemed too young."
.\data\Client6\clips\common_voice_en_42710541.mp3,"Charles Frederick was the controller, captain Thomas Desaguliers was the chief fire master."
.\data\Client6\clips\common_voice_en_42710542.mp3,The aye-aye lives primarily on the east coast of Madagascar.
.\data\Client6\clips\common_voice_en_42710543.mp3,"Management finally relented, and Kahane was appointed the company pilot."
.\data\Client6\clips\common_voice_en_42710544.mp3,Washington uses a city manager to run the day-to-day activities.
.\data\Client6\clips\common_voice_en_42710545.mp3,The large majority of the residents came from the poorest parts of New Orleans.
.\data\Client6\clips\common_voice_en_42710546.mp3,"Currently, he reviews photography exhibitions for The New Yorker."
.\data\Client6\clips\common_voice_en_42710547.mp3,The genuine car in fact features conventional opening doors.
.\data\Client6\clips\common_voice_en_42710548.mp3,The Merioneth area remains one of the strongest Welsh-speaking parts of Wales.
.\data\Client6\clips\common_voice_en_42710549.mp3,The Sandinista government was facing armed opposition from the Contras.
.\data\Client6\clips\common_voice_en_42710550.mp3,He also guest starred with Brown in various television roles.
.\data\Client6\clips\common_voice_en_42710551.mp3,"So, without further ado let’s jump in!"
.\data\Client6\clips\common_voice_en_42710552.mp3,He could seek the support of civil authorities.
.\data\Client6\clips\common_voice_en_42710553.mp3,Harris spoke in detail about his career.
.\data\Client6\clips\common_voice_en_42710554.mp3,"Thiago had a successful debut campaign, scoring six goals and seven assists."
.\data\Client6\clips\common_voice_en_42710555.mp3,The force's goal was to police the mutant population in Europe.
.\data\Client6\clips\common_voice_en_42710556.mp3,"“Yes,” replied Miriam, as she walked at his side."
.\data\Client6\clips\common_voice_en_42710557.mp3,More recently Hester Street in Officer was named after him.
.\data\Client6\clips\common_voice_en_42710558.mp3,Moore was born in Liverpool.
.\data\Client6\clips\common_voice_en_42710559.mp3,Flowering occurs from March to September.
.\data\Client6\clips\common_voice_en_42710560.mp3,The album includes a composing contribution from Gerry Beckley of the band America.
.\data\Client6\clips\common_voice_en_42710561.mp3,She generally uses the name Christina Magnuson.
.\data\Client6\clips\common_voice_en_42710562.mp3,The show found its comedy in Crewe's attempts to adapt to Canadian culture.
.\data\Client6\clips\common_voice_en_42710563.mp3,"Also, a mixture of chicken and rice known as galinhada is very popular."
.\data\Client6\clips\common_voice_en_42710564.mp3,This would always be preceded by a rather convoluted introduction from Fry.
.\data\Client6\clips\common_voice_en_42710565.mp3,Lampitt worked on efforts to streamline town management and eliminate bureaucracy.
.\data\Client6\clips\common_voice_en_42710566.mp3,On his way to Rome Wilfrid stopped in Frisia to visit Willibrord.
.\data\Client6\clips\common_voice_en_42710567.mp3,The complex was destroyed in rebuilt several times throughout the Heian period.
.\data\Client6\clips\common_voice_en_42710568.mp3,DirectShow was also natively added.
.\data\Client6\clips\common_voice_en_42710569.mp3,The area of the former Irkutsk Governorate became part of the East Siberian Krai.
.\data\Client6\clips\common_voice_en_42710570.mp3,Grandi had family support out for himself and his wife during the Turin Olympics.
.\data\Client6\clips\common_voice_en_42710571.mp3,"Varian is married and has one child, Christopher Max Varian."
.\data\Client6\clips\common_voice_en_42710572.mp3,Ramsden created one of the first high-quality dividing engines.
.\data\Client6\clips\common_voice_en_42710573.mp3,The unit also investigates missing persons.
.\data\Client6\clips\common_voice_en_42710574.mp3,The town's layout with its central square is attributed to architect Antoni Tyzenhauz.
.\data\Client6\clips\common_voice_en_42710575.mp3,The Moric is then presumably devoured by Pen's giant dragon.
.\data\Client6\clips\common_voice_en_42710576.mp3,"After dark, they then set to work by torch light to salvage their plane."
.\data\Client6\clips\common_voice_en_42710607.mp3,Hodder was married three times.
.\data\Client6\clips\common_voice_en_42710608.mp3,It's very impressionistic.
.\data\Client6\clips\common_voice_en_42710609.mp3,"Traditionally, blinis are baked in a Russian oven."
.\data\Client6\clips\common_voice_en_42710610.mp3,Mr. Mafizul Islam Khan Kamal is the Executive President of the Party.
.\data\Client6\clips\common_voice_en_42710611.mp3,Its music video was directed by Kevin G. Bray.
.\data\Client6\clips\common_voice_en_42710612.mp3,"I don't like your country, although it is so beautiful."
.\data\Client6\clips\common_voice_en_42710613.mp3,People who think masturbation is harmful are falling for pseudoscience.
.\data\Client6\clips\common_voice_en_42710614.mp3,"Education research and information are essential to improving teaching, learning, and educational decision-making."
.\data\Client6\clips\common_voice_en_42710615.mp3,They can go for extended periods of time without drinking water.
.\data\Client6\clips\common_voice_en_42710616.mp3,Such an analog calculation is difficult.
.\data\Client6\clips\common_voice_en_42710617.mp3,Fortuyn's former party Livable Netherlands also contested the election.
.\data\Client6\clips\common_voice_en_42710618.mp3,Smart put forward two lines of argument.
.\data\Client6\clips\common_voice_en_42710619.mp3,Beene was known as both an innovator and a teacher.
.\data\Client6\clips\common_voice_en_42710620.mp3,"Lemon is featured on the ""Thirteen"" soundtrack."
.\data\Client6\clips\common_voice_en_42710621.mp3,"After the American Civil War, he had settled in Laramie, Wyoming."
.\data\Client6\clips\common_voice_en_42710622.mp3,Four other special wards surround Meguro.
.\data\Client6\clips\common_voice_en_42710623.mp3,Grey was appointed captain but surrendered after a sharp siege in the early autumn.
.\data\Client6\clips\common_voice_en_42710624.mp3,The winner of the Oceania qualification qualified for the Thomas Cup.
.\data\Client6\clips\common_voice_en_42710625.mp3,Some of her vaudeville gags were employed in the show.
.\data\Client6\clips\common_voice_en_42710626.mp3,The ships were built by Samsung Heavy Industries in South Korea.
.\data\Client6\clips\common_voice_en_42710627.mp3,"Most recently, Travis starred in the Subaru television commercial, ""Ricky""."
.\data\Client6\clips\common_voice_en_42710628.mp3,Books can be bought by mail-order or in person at the Society.
.\data\Client6\clips\common_voice_en_42710629.mp3,The music video was directed by Brian Grant.
.\data\Client6\clips\common_voice_en_42710630.mp3,"In Singapore, he qualified eighth in front of Schumacher."
.\data\Client6\clips\common_voice_en_42710631.mp3,"He seems omniscient, able to predict the future and appear in people's dreams."
.\data\Client6\clips\common_voice_en_42710632.mp3,Plants of this genus are perennial herbs growing from rhizomes.
.\data\Client6\clips\common_voice_en_42710633.mp3,He is the younger brother of Adam Mosseri.
.\data\Client6\clips\common_voice_en_42710634.mp3,"The group began playing weekly at the Village Pub in Port Jefferson, New York."
.\data\Client6\clips\common_voice_en_42710635.mp3,The action is transposed to Savoie in France.
.\data\Client6\clips\common_voice_en_42710636.mp3,Yeats described the play as powerful with a beautiful constrained passion.
.\data\Client6\clips\common_voice_en_42710637.mp3,Certain instrumental errors could be averaged out by reversing the telescope on its mounting.
.\data\Client6\clips\common_voice_en_42710638.mp3,They are commonly used in research and regenerative medicine.
.\data\Client6\clips\common_voice_en_42710639.mp3,He became a member of the Sigma Chi Fraternity as an undergraduate.
.\data\Client6\clips\common_voice_en_42710640.mp3,This makes Egeria a prominent candidate for future water-mining ventures.
.\data\Client6\clips\common_voice_en_42710641.mp3,"Brooks Sports, Incorporated headquarters are located in Seattle, Washington, United States."
.\data\Client6\clips\common_voice_en_42710642.mp3,We just worked separately.
.\data\Client6\clips\common_voice_en_42710643.mp3,He'd eventually start a music publishing company with Robbins.
.\data\Client6\clips\common_voice_en_42710644.mp3,The municipality sprouted from humble beginnings at Walter C. Ohlerts Tourist Camp.
.\data\Client6\clips\common_voice_en_42710645.mp3,The mascot of Keyser High is the Golden Tornado.
.\data\Client6\clips\common_voice_en_42710646.mp3,"Viator grew up in New Iberia, Louisiana."
.\data\Client6\clips\common_voice_en_42710647.mp3,He currently lives in Toronto with his partner Andrew Champion.
.\data\Client6\clips\common_voice_en_42710648.mp3,Plockton is a settlement on the shores of Loch Carron.
.\data\Client6\clips\common_voice_en_42710649.mp3,"Then Mardonius sacked Athens, which had been deserted before the Battle of Salamis."
.\data\Client6\clips\common_voice_en_42710650.mp3,"A discussion of this can be found in the main ""Tornieria"" article."
.\data\Client6\clips\common_voice_en_42710651.mp3,However two loud explosions were heard in Riyadh.
.\data\Client6\clips\common_voice_en_42710652.mp3,"Three years later, Doctor Brandt echoed this commitment."
.\data\Client6\clips\common_voice_en_42710653.mp3,Note that the Fourier phase depends on one's choice of coordinate origin.
.\data\Client6\clips\common_voice_en_42710654.mp3,"Regular events at the club carried names like ""Psychedelic Trance"" and ""Special Experience""."
.\data\Client6\clips\common_voice_en_42710655.mp3,"During the period, however, these instruments were simply called trumpets."
.\data\Client6\clips\common_voice_en_42710656.mp3,It features the vocals and lyrics of Chelonis R. Jones.
.\data\Client6\clips\common_voice_en_42710657.mp3,Another advantage of computers is the availability of online language courses.
.\data\Client6\clips\common_voice_en_42710658.mp3,"During this time, the collaborators separated and Gabriel Pascal died."
.\data\Client6\clips\common_voice_en_42710659.mp3,A proposal for action was sent to the Indian Ministry of Home Affairs.
