filename,text
.\data\Client6\clips\common_voice_en_42710660.mp3,"Pohjola studied classical piano and violin at the Sibelius Academy in Helsinki, Finland."
.\data\Client6\clips\common_voice_en_42710661.mp3,She decided that she could make charcoal briquettes from biomass.
.\data\Client6\clips\common_voice_en_42710662.mp3,The group has a portfolio of investments to help support its journalism.
.\data\Client6\clips\common_voice_en_42710663.mp3,"For added convenience, both the frame-mounted thumb safety and the magazine release are ambidextrous."
.\data\Client6\clips\common_voice_en_42710664.mp3,"In Natchez, there are a number of private and parochial schools."
.\data\Client6\clips\common_voice_en_42710665.mp3,Politically it espouses a strong sentiment of nationalism.
.\data\Client6\clips\common_voice_en_42710666.mp3,The plateau is believed to be the home to the lost city of Pteria.
.\data\Client6\clips\common_voice_en_42710667.mp3,Maliha was born in Khulna.
.\data\Client6\clips\common_voice_en_42710668.mp3,"Several organizations have developed such sets of principles, which vary by territory."
.\data\Client6\clips\common_voice_en_42710669.mp3,I'm amazed how quickly we came up with the material.
.\data\Client6\clips\common_voice_en_42710670.mp3,"Freed in the teen drama web series ""Miss Behave""."
.\data\Client6\clips\common_voice_en_42710671.mp3,"Today, Moog Music is the leading manufacturer of performance-quality theremins."
.\data\Client6\clips\common_voice_en_42710672.mp3,The night marked the worst defeat by a Russian hockey team in international competition.
.\data\Client6\clips\common_voice_en_42710673.mp3,This practically shut out the pro-democratic parties and individuals.
.\data\Client6\clips\common_voice_en_42710674.mp3,"The research is convincing, the plotting taut, the scenes wonderfully vivid."
.\data\Client6\clips\common_voice_en_42710675.mp3,Canna was born to architect Hasmukh Patel and Bhakti Patel.
.\data\Client6\clips\common_voice_en_42710676.mp3,The small inscription also uses the younger futhark version of the s-rune.
.\data\Client6\clips\common_voice_en_42710677.mp3,"The novel subtly criticizes capitalism, or at least classism, as a means of escape."
.\data\Client6\clips\common_voice_en_42710678.mp3,"Notably, the album does not include the main theme song ""Everything or Nothing""."
.\data\Client6\clips\common_voice_en_42710679.mp3,It must be his own doing; he is his own master.
.\data\Client6\clips\common_voice_en_42710680.mp3,All unions were childless.
.\data\Client6\clips\common_voice_en_42710681.mp3,Kevin Hoskins from Jesus Freak Hideout rated the album three stars out of five.
.\data\Client6\clips\common_voice_en_42710682.mp3,One must discover their personality types and find out which learning style suits best.
.\data\Client6\clips\common_voice_en_42710683.mp3,Lead was formerly mined in County Monaghan.
.\data\Client6\clips\common_voice_en_42710684.mp3,The color varies from green to yellow.
.\data\Client6\clips\common_voice_en_42710685.mp3,After Meldrum it was John Flint who was another important influence.
.\data\Client6\clips\common_voice_en_42710686.mp3,It was accompanied by illustrations by the artist Harold von Schmidt.
.\data\Client6\clips\common_voice_en_42710687.mp3,The day the world ended was the day hope vanished.
.\data\Client6\clips\common_voice_en_42710688.mp3,The current Health Minister is Deputy Richard Renouf.
.\data\Client6\clips\common_voice_en_42710689.mp3,She was awarded the Seventeen Magazine National Youth Volunteerism Award.
.\data\Client6\clips\common_voice_en_42710690.mp3,"Stand away, you two, he said."
.\data\Client6\clips\common_voice_en_42710691.mp3,Windshields that cannot be repaired have to be replaced.
.\data\Client6\clips\common_voice_en_42710692.mp3,It was directed by Hausmann.
.\data\Client6\clips\common_voice_en_42710693.mp3,Hackworth shut down Stern John.
.\data\Client6\clips\common_voice_en_42710694.mp3,Here appropriate lections relevant to the season are chosen.
.\data\Client6\clips\common_voice_en_42710695.mp3,The tower of the hotel has become a popular local attraction.
.\data\Client6\clips\common_voice_en_42710696.mp3,He obtained his nursing certificate in Nigeria.
.\data\Client6\clips\common_voice_en_42710697.mp3,He graduated from Shih Hsin University.
.\data\Client6\clips\common_voice_en_42710698.mp3,The violins made in Reghin are used abroad.
.\data\Client6\clips\common_voice_en_42710699.mp3,This creates a realistic color and shape.
.\data\Client6\clips\common_voice_en_42710700.mp3,The workshops were often called the Crewe Works of North Norfolk.
.\data\Client6\clips\common_voice_en_42710701.mp3,"However, there are fewer Yayoi period sites."
.\data\Client6\clips\common_voice_en_42710702.mp3,"It is not common in the United States where the spelling ""Davis"" is preferred."
.\data\Client6\clips\common_voice_en_42710703.mp3,The local United Methodist church is located in nearby East Randolph.
.\data\Client6\clips\common_voice_en_42710704.mp3,Numerous visitors from all over Europe visited and admired the Ariadne.
.\data\Client6\clips\common_voice_en_42710720.mp3,The set of all such extensions is studied in the ramification theory of valuations.
.\data\Client6\clips\common_voice_en_42710721.mp3,I really impressed upon him that he had to be prepared for this movie.
.\data\Client6\clips\common_voice_en_42710722.mp3,He is one of the most prominent environmental activists in the state.
.\data\Client6\clips\common_voice_en_42710723.mp3,Altrincham Golf Club offers competitive golf on a large scale.
.\data\Client6\clips\common_voice_en_42710724.mp3,Murphy attended college at the University of Idaho.
.\data\Client6\clips\common_voice_en_42710855.mp3,The Porkbusters project endorsed the Coburn Amendment.
.\data\Client6\clips\common_voice_en_42710856.mp3,"Despite these differences, Classical art and Contemporary art share some common themes and concerns."
.\data\Client6\clips\common_voice_en_42710857.mp3,Then the organization dissolved itself.
.\data\Client6\clips\common_voice_en_42710858.mp3,Jay-Z killed him!
.\data\Client6\clips\common_voice_en_42710859.mp3,Its transmitter is located in Sherwood Park.
.\data\Client6\clips\common_voice_en_42711332.mp3,There human bones were broken open to obtain the marrow.
.\data\Client6\clips\common_voice_en_42711333.mp3,It is likely to be the oldest and largest Protestant denomination of Bhutan.
.\data\Client6\clips\common_voice_en_42711334.mp3,Only matches for the senior men's national team were included.
.\data\Client6\clips\common_voice_en_42711335.mp3,"The weapons embargo, travel restrictions, and financial sanctions remain in force."
.\data\Client6\clips\common_voice_en_42711336.mp3,This section has uncovered the village from the Byzantine and Early Arab periods.
.\data\Client6\clips\common_voice_en_42711896.mp3,"Her home port is Long Beach, California."
.\data\Client6\clips\common_voice_en_42711897.mp3,The business was exceptionally profitable due to a rapidly ageing population.
.\data\Client6\clips\common_voice_en_42711898.mp3,This was recorded in the subscriptions of the manuscripts of Livy.
.\data\Client6\clips\common_voice_en_42711899.mp3,The Enright family managed a major department store.
.\data\Client6\clips\common_voice_en_42711911.mp3,Between Selborne Hanger and Coneycroft Hill is a deep dell.
.\data\Client6\clips\common_voice_en_42711912.mp3,The nearest London Underground stations are Holborn and Chancery Lane.
.\data\Client6\clips\common_voice_en_42711913.mp3,Later that year he served in Germany under the Marquess of Granby.
.\data\Client6\clips\common_voice_en_42711914.mp3,I persuaded him to take a walk this morning.
.\data\Client6\clips\common_voice_en_42711915.mp3,It also has important industrial areas and production capacity.
.\data\Client6\clips\common_voice_en_42712773.mp3,Sri.
.\data\Client6\clips\common_voice_en_42712775.mp3,Strombids have long eye stalks.
.\data\Client6\clips\common_voice_en_42712777.mp3,Then the organization dissolved itself.
.\data\Client6\clips\common_voice_en_42712779.mp3,The main forms of public transport are buses and taxis.
.\data\Client6\clips\common_voice_en_42712780.mp3,John Cobb was one of the first to take advantage of the opportunity.
.\data\Client6\clips\common_voice_en_42712822.mp3,On his way to Rome Wilfrid stopped in Frisia to visit Willibrord.
.\data\Client6\clips\common_voice_en_42712823.mp3,Beene was known as both an innovator and a teacher.
.\data\Client6\clips\common_voice_en_42712824.mp3,"For the first year that the market operated, there was no specific site plan."
.\data\Client6\clips\common_voice_en_42712825.mp3,"Carmen, who's true to her instincts, represents everything he tries to repress."
.\data\Client6\clips\common_voice_en_42712826.mp3,"To meet increasing demand, Caritas Medical Centre recently underwent a major redevelopment project."
.\data\Client6\clips\common_voice_en_42712837.mp3,"It asserted man's importance as a cultivated being, in control of his moral universe."
.\data\Client6\clips\common_voice_en_42712839.mp3,All sixteen members of the landing party received the Polar Medal.
.\data\Client6\clips\common_voice_en_42712840.mp3,"In Hillesheim are two kindergartens, one primary school, one Hauptschule and one Realschule."
.\data\Client6\clips\common_voice_en_42712841.mp3,"Dolby saw music videos with story lines as ""short silent films with a soundtrack""."
.\data\Client6\clips\common_voice_en_42712851.mp3,"Currently, he reviews photography exhibitions for The New Yorker."
.\data\Client6\clips\common_voice_en_42712852.mp3,Some pupils come from the civilian sector.
.\data\Client6\clips\common_voice_en_42712853.mp3,"It was available in Metropolitan Grey, Dark Blue, or Brilliant Black exterior paint."
.\data\Client6\clips\common_voice_en_42712854.mp3,Over the years they migrated up through present-day Ohio and into Wisconsin.
.\data\Client6\clips\common_voice_en_42712855.mp3,It is difficult to regard the coincidence as purely accidental.
.\data\Client6\clips\common_voice_en_42712899.mp3,"To identify the conjugate acid, look for the pair of compounds that are related."
.\data\Client6\clips\common_voice_en_42712900.mp3,"Cortes sent Olid to Michoacan, after he had married a Portuguese lady."
.\data\Client6\clips\common_voice_en_42712901.mp3,Numerous visitors from all over Europe visited and admired the Ariadne.
.\data\Client6\clips\common_voice_en_42712902.mp3,His father was a school master at Netherthorpe Grammar School in Staveley.
.\data\Client6\clips\common_voice_en_42712903.mp3,The album includes a composing contribution from Gerry Beckley of the band America.
.\data\Client6\clips\common_voice_en_42713019.mp3,"The music was written by David Mann; the lyrics, by Bob Hilliard."
.\data\Client6\clips\common_voice_en_42713020.mp3,Building software is an end-to-end process that involves many distinct functions.
.\data\Client6\clips\common_voice_en_42713021.mp3,The officials lacked official uniforms and seals.
.\data\Client6\clips\common_voice_en_42713022.mp3,Local gift shops sell maps of the shipwrecks on the ocean floor.
.\data\Client6\clips\common_voice_en_42713023.mp3,Girouard is located in the Bow River valley south of Lake Minnewanka.
.\data\Client6\clips\common_voice_en_42713189.mp3,"The specific ""paludicola"" is Latin, from ""paludis"", ""swamp"", and ""colere"", ""to inhabit""."
.\data\Client6\clips\common_voice_en_42713190.mp3,"Two parts of the set were then sold and kept at Steamport, Southport."
.\data\Client6\clips\common_voice_en_42713191.mp3,It was designed by Jarvis Hunt who also designed Bamberger's flagship Newark store.
.\data\Client6\clips\common_voice_en_42713192.mp3,The original old village formed on a mount between shallow lakes.
.\data\Client6\clips\common_voice_en_42713193.mp3,The company produces mainly rugged military and amfibia mechanical watches.
.\data\Client6\clips\common_voice_en_42713194.mp3,Backward induction assumes that all future play will be rational.
.\data\Client6\clips\common_voice_en_42713195.mp3,This was not done without controversy.
.\data\Client6\clips\common_voice_en_42713196.mp3,A job that is nowadays operated by The Tampere Islamic Congregation.
.\data\Client6\clips\common_voice_en_42713197.mp3,Male and female traffickers Brunei come from all social and economic classes.
.\data\Client6\clips\common_voice_en_42713198.mp3,"Affleck, who was a relative unknown at the time, was cast as Shannon Hamilton."
.\data\Client6\clips\common_voice_en_42713199.mp3,"He stayed at Kingsley Hall, the Lesters' foundation at Bow."
.\data\Client6\clips\common_voice_en_42713200.mp3,"Stresemann was born in Dresden to Richard, an apothecary and Marie."
.\data\Client6\clips\common_voice_en_42713201.mp3,The first two are the easiest because they each only require two tables.
.\data\Client6\clips\common_voice_en_42713202.mp3,Townsend was born in Woking to Lois Henderson and Lieutenant Colonel Cyril Townsend.
.\data\Client6\clips\common_voice_en_42713203.mp3,Sorkin played four years of college basketball at the University of Oregon.
.\data\Client6\clips\common_voice_en_42713204.mp3,Its president is Leith Anderson.
.\data\Client6\clips\common_voice_en_42713205.mp3,Some semiprozines publish original fiction.
.\data\Client6\clips\common_voice_en_42713206.mp3,"Clara, a little way off, was looking at the cowslips disconsolately."
.\data\Client6\clips\common_voice_en_42713207.mp3,Bonaire is the hometown of former Governor Sonny Perdue.
.\data\Client6\clips\common_voice_en_42713208.mp3,"Shortly after his arrival, an influenza epidemic swept the diocese."
.\data\Client6\clips\common_voice_en_42713209.mp3,"Shendu goes after Jackie, but accidentally possesses Valmont instead."
.\data\Client6\clips\common_voice_en_42713210.mp3,Their current use is largely explained by the international success of the Japanese manga.
.\data\Client6\clips\common_voice_en_42713211.mp3,American film critic Armond White hailed Statham's ascension as an action film star.
.\data\Client6\clips\common_voice_en_42713212.mp3,"The team would change its name again, two years later, to the Tennessee Titans."
.\data\Client6\clips\common_voice_en_42713213.mp3,A faint ghost crater lies in the mare to the northeast.
.\data\Client6\clips\common_voice_en_42713214.mp3,Thus ended the last of the Byzantine Empire proper.
.\data\Client6\clips\common_voice_en_42713215.mp3,Other companies have attempted to create their own Kiwiana.
.\data\Client6\clips\common_voice_en_42713216.mp3,"The climate is cold, and their water comes from springs and wells."
.\data\Client6\clips\common_voice_en_42713217.mp3,The video was directed by John Hardwick.
.\data\Client6\clips\common_voice_en_42713218.mp3,"Are you in pain, darling?"
.\data\Client6\clips\common_voice_en_42713219.mp3,Whilst there he lived at Longburton Rectory.
.\data\Client6\clips\common_voice_en_42713220.mp3,The males are also larger than the workers but smaller than the queens.
.\data\Client6\clips\common_voice_en_42713221.mp3,Network Design and Architecture by Spencer James Coon
.\data\Client6\clips\common_voice_en_42713222.mp3,O'Brien and others rejoined the party temporarily for the sake of unity.
.\data\Client6\clips\common_voice_en_42713223.mp3,This album features electronic and synthesized piano throughout.
.\data\Client6\clips\common_voice_en_42713224.mp3,Sony Mobile Communications has its headquarters in the borough.
.\data\Client6\clips\common_voice_en_42713225.mp3,At least three online obituaries to Snow may be traced.
.\data\Client6\clips\common_voice_en_42713226.mp3,"Ful is a popular breakfast dish in Syria, especially Aleppo."
.\data\Client6\clips\common_voice_en_42713227.mp3,It was a junction for Lohian and Ferozepur.
.\data\Client6\clips\common_voice_en_42713228.mp3,They were reared in West Carroll Parish in northeastern Louisiana.
.\data\Client6\clips\common_voice_en_42713229.mp3,Jackson graduated from Toledo High School.
.\data\Client6\clips\common_voice_en_42713230.mp3,"His surname has also been spelled Wernigke, Warneck, and Werneke."
.\data\Client6\clips\common_voice_en_42713231.mp3,She was one of John Kerry's first celebrity endorsers.
.\data\Client6\clips\common_voice_en_42713232.mp3,"The single was another commercial failure, and was Bowie's last recording on Pye."
.\data\Client6\clips\common_voice_en_42713233.mp3,This serves the local area with water.
.\data\Client6\clips\common_voice_en_42713235.mp3,"This leaves just ""Wardour, Princess"" and ""Whitcomb"" streets."
.\data\Client6\clips\common_voice_en_42713237.mp3,The station is owned and operated by the Clearbrook Mennonite Brethren Church.
.\data\Client6\clips\common_voice_en_42713238.mp3,"She is best known as the former vocalist in the gothic metal band, Tristania."
.\data\Client6\clips\common_voice_en_42713239.mp3,Marches are common throughout basic training.
.\data\Client6\clips\common_voice_en_42713240.mp3,"As a result, she held her fire in this period."
.\data\Client6\clips\common_voice_en_42713243.mp3,He held lands in Wiltshire.
.\data\Client6\clips\common_voice_en_42713244.mp3,"However, the party has continued on the left-wing field."
.\data\Client6\clips\common_voice_en_42713245.mp3,"His interests include golf, flying and reading."
.\data\Client6\clips\common_voice_en_42713246.mp3,He previously played for the Auburn Tigers.
.\data\Client6\clips\common_voice_en_42713247.mp3,"The site would, however, become used for coalmining."
.\data\Client6\clips\common_voice_en_42713248.mp3,"In addition to the Dukedom, Hamilton was created Baron Dutton in Cheshire."
.\data\Client6\clips\common_voice_en_42713249.mp3,Marken was an island in the Zuiderzee.
.\data\Client6\clips\common_voice_en_42713250.mp3,Moale suffered three dead and twenty-five wounded.
.\data\Client6\clips\common_voice_en_42713251.mp3,How long have you been visiting your granny in the countryside?
.\data\Client6\clips\common_voice_en_42713252.mp3,"He moved his candy-making operations there, and America's First Roadside Candy Store was born."
.\data\Client6\clips\common_voice_en_42713258.mp3,The snack is named as such because it is derived from cassava.
.\data\Client6\clips\common_voice_en_42713259.mp3,Only Bobby Parker has held the Hearts captaincy for a longer period.
.\data\Client6\clips\common_voice_en_42713260.mp3,Shipbuilding and boatmaking may have been prosperous industries in ancient India.
.\data\Client6\clips\common_voice_en_42713261.mp3,"When their efforts failed, ""Spangler"" joined the fray."
.\data\Client6\clips\common_voice_en_42713262.mp3,They toured widely every summer throughout this period.
.\data\Client6\clips\common_voice_en_42713263.mp3,He worked in Lucerne as a chancellor.
.\data\Client6\clips\common_voice_en_42713264.mp3,Maori occupation in this area seems to have been mainly seasonal.
.\data\Client6\clips\common_voice_en_42713265.mp3,Around that time Haight began operating part of the building as the Union Hotel.
.\data\Client6\clips\common_voice_en_42713266.mp3,He has lectured at educational and cultural institutions all over North America and Europe.
.\data\Client6\clips\common_voice_en_42713267.mp3,Before deciding to become an architect he had plans to be an art-gallery owner.
.\data\Client6\clips\common_voice_en_42713272.mp3,Chichester Terrace incorporated the earlier Chichester House.
.\data\Client6\clips\common_voice_en_42713273.mp3,Tank was raised beside the shores of the Great Lakes.
.\data\Client6\clips\common_voice_en_42713274.mp3,Other international karting competition was mostly sporadic but generally successful.
.\data\Client6\clips\common_voice_en_42713275.mp3,Bellarmine also competes against local schools in the Coast Forensic League.
.\data\Client6\clips\common_voice_en_42713276.mp3,"His remains were interred at Coachella Valley Public Cemetery in Coachella, California."
.\data\Client6\clips\common_voice_en_42713277.mp3,The cellar spiders torso is thin and doesn't have a fixed colour.
.\data\Client6\clips\common_voice_en_42713278.mp3,Graduates were admitted as sophomores at the University of Arkansas at Fayetteville.
.\data\Client6\clips\common_voice_en_42713279.mp3,"In the end, the British captured the fort and settlement, carrying away its supplies."
.\data\Client6\clips\common_voice_en_42713280.mp3,Nathaniel Jeremiah Bradlee served as the designing architect.
.\data\Client6\clips\common_voice_en_42713281.mp3,"It is part of the Wausau, Wisconsin Metropolitan Statistical Area."
.\data\Client6\clips\common_voice_en_42713287.mp3,"However, several physical and psychological tests are required before entering."
.\data\Client6\clips\common_voice_en_42713288.mp3,The second sentence states that the Netherlands is famous for its tulips.
.\data\Client6\clips\common_voice_en_42713289.mp3,Zelter claims to be a self professed 'global citizen'.
.\data\Client6\clips\common_voice_en_42713290.mp3,Any organization or individual can nominate a documentary item for inscription on the Register.
.\data\Client6\clips\common_voice_en_42713291.mp3,The battle between the Corporations has re-emerged and continues unabated.
.\data\Client6\clips\common_voice_en_42713294.mp3,It was made by the Edison Studios shortly before they withdrew from production activities.
.\data\Client6\clips\common_voice_en_42713296.mp3,"He was born in Kleinliebental, Grossliebental, Ukraine."
.\data\Client6\clips\common_voice_en_42713297.mp3,"In the photo, the woman is accompanied by a retinue at her rear."
.\data\Client6\clips\common_voice_en_42713298.mp3,At the end of the war all of the Dunera Boys were released.
.\data\Client6\clips\common_voice_en_42713300.mp3,The calculation of these operating losses was disputed.
.\data\Client6\clips\common_voice_en_42713301.mp3,A cyclotron may be used for this purpose.
.\data\Client6\clips\common_voice_en_42713302.mp3,"Sources: ""American Mass-Market Magazines"" ""The Wall Street Journal"" and ""New York Post""."
.\data\Client6\clips\common_voice_en_42713303.mp3,The prevailing mood was one of barely concealed paranoia.
.\data\Client6\clips\common_voice_en_42713304.mp3,Migrants from Ilocos and La Union from the north also resettled in the area.
.\data\Client6\clips\common_voice_en_42713305.mp3,Each new project will record the actual time spent.
.\data\Client6\clips\common_voice_en_42713306.mp3,The University of South Alabama canceled two athletic events in advance of the storm.
.\data\Client6\clips\common_voice_en_42713307.mp3,The weakness of nations is in actual war.
.\data\Client6\clips\common_voice_en_42713308.mp3,"In India and other tropical regions, malaria was a persistent problem."
.\data\Client6\clips\common_voice_en_42713309.mp3,The services are currently operated by TfL Rail.
.\data\Client6\clips\common_voice_en_42713315.mp3,"The song appeared on an episode of ""Hindsight""."
.\data\Client6\clips\common_voice_en_42713316.mp3,"The name stuck and it became Star, Idaho."
.\data\Client6\clips\common_voice_en_42713317.mp3,The area also forms part of the route of the Wolverhampton Marathon.
.\data\Client6\clips\common_voice_en_42713318.mp3,The offices of the lieutenant governor are at the state capital of Dover.
.\data\Client6\clips\common_voice_en_42713319.mp3,The Mantoux test is now used.
.\data\Client6\clips\common_voice_en_42713320.mp3,The family of the deceased is reckoned unclean for three days.
.\data\Client6\clips\common_voice_en_42713322.mp3,"Slowly as you listen, entranced by the mood, the songs begin to shine through."
.\data\Client6\clips\common_voice_en_42713323.mp3,"It will not, however, read clear or colored vinyl records."
.\data\Client6\clips\common_voice_en_42713325.mp3,Blane lived at Burghfield in Berkshire and at Kirkoswald in Ayrshire.
.\data\Client6\clips\common_voice_en_42713326.mp3,"More than anything, he fears constantly that she will engage in sexual promiscuity."
.\data\Client6\clips\common_voice_en_42713329.mp3,Russia and Serbia and Montenegro made their debut in the competition this year.
.\data\Client6\clips\common_voice_en_42713330.mp3,Ans was exposed to photography as a teenager by her stepfather.
.\data\Client6\clips\common_voice_en_42713331.mp3,"For any additional snack servings, an individual may consume fruits and vegetables."
.\data\Client6\clips\common_voice_en_42713332.mp3,Jemima thought him mighty civil and handsome.
.\data\Client6\clips\common_voice_en_42713333.mp3,Sandwiches were offered for free.
.\data\Client6\clips\common_voice_en_42713334.mp3,She is the daughter of Boris Johnson and his second wife Marina Wheeler.
.\data\Client6\clips\common_voice_en_42713335.mp3,Croce was born in Trieste.
.\data\Client6\clips\common_voice_en_42713336.mp3,They commuted by ferries.
.\data\Client6\clips\common_voice_en_42713337.mp3,This is a feature on nearly all modern operating systems.
.\data\Client6\clips\common_voice_en_42713338.mp3,"After a number of crews nearly asphyxiated, the locomotive was run in reverse."
.\data\Client6\clips\common_voice_en_42713343.mp3,Franchises from Minnesota and North Dakota were added during the two Dakota League seasons.
.\data\Client6\clips\common_voice_en_42713344.mp3,Losey married three times and divorced twice.
.\data\Client6\clips\common_voice_en_42713346.mp3,The rules do not specify how much damage is done by each hit.
.\data\Client6\clips\common_voice_en_42713347.mp3,good morning
.\data\Client6\clips\common_voice_en_42713348.mp3,The other important spawning ground of the Atlantic bluefin is the Gulf of Mexico.
.\data\Client6\clips\common_voice_en_42713349.mp3,He originally used his nickname Deacon in posting to the blog.
.\data\Client6\clips\common_voice_en_42713350.mp3,The name Jehoram is confusing in the biblical account.
.\data\Client6\clips\common_voice_en_42713351.mp3,Winners are selected based on a vote by registered users.
