filename,text
.\data\Client6\clips\common_voice_en_42696072.mp3,But then something even more extraordinary happened.
.\data\Client6\clips\common_voice_en_42696165.mp3,The division was then commanded by Major General John Hawkesworth.
.\data\Client6\clips\common_voice_en_42696166.mp3,"Her husband was Li Shi, the last emperor of Cheng Han."
.\data\Client6\clips\common_voice_en_42696167.mp3,"London advances against Ludington, Michigan, champions of the Central League."
.\data\Client6\clips\common_voice_en_42696168.mp3,But his books were never best-sellers.
.\data\Client6\clips\common_voice_en_42696169.mp3,No new team would replace them.
.\data\Client6\clips\common_voice_en_42696402.mp3,"During the early twentieth century, the term sergeant piper was used instead."
.\data\Client6\clips\common_voice_en_42696403.mp3,"Demchinsky, and Yu.A."
.\data\Client6\clips\common_voice_en_42698957.mp3,The album was marked with strong anti-war and pro-anarchism songs.
.\data\Client6\clips\common_voice_en_42698959.mp3,"A date rapist still has to get a ""date""!"
.\data\Client6\clips\common_voice_en_42698961.mp3,"The rectangular shape of the nabedrennik differs from the epigonation, which is lozenge-shaped."
.\data\Client6\clips\common_voice_en_42698963.mp3,"That year, the White Sox won the pennant and their first World Series."
.\data\Client6\clips\common_voice_en_42698965.mp3,He was the first chief justice to be native born.
.\data\Client6\clips\common_voice_en_42698982.mp3,Faversham were runners-up in their first season in the Metropolitan-London League.
.\data\Client6\clips\common_voice_en_42698983.mp3,He was hospitalized with a broken leg.
.\data\Client6\clips\common_voice_en_42698984.mp3,The show aired on Nicktoonsters in the United Kingdom.
.\data\Client6\clips\common_voice_en_42698985.mp3,"Together they are referred to as a ""kelly drive""."
.\data\Client6\clips\common_voice_en_42698986.mp3,The plan envisaged two mounted divisions.
.\data\Client6\clips\common_voice_en_42698997.mp3,Sun Quan received and treated him very respectfully.
.\data\Client6\clips\common_voice_en_42698998.mp3,Both Lipscomb and Harding are Churches of Christ institutions.
.\data\Client6\clips\common_voice_en_42698999.mp3,Fobbing is one of seven conservation areas in Thurrock.
.\data\Client6\clips\common_voice_en_42699000.mp3,It also refers to converting to Hinduism.
.\data\Client6\clips\common_voice_en_42699001.mp3,At least seven people were killed overall in the incident.
.\data\Client6\clips\common_voice_en_42699867.mp3,"Walter also designed mansions, banks, churches, the hotel at Brandywine Springs, and courthouses."
.\data\Client6\clips\common_voice_en_42699868.mp3,All songs written by Carly Simon.
.\data\Client6\clips\common_voice_en_42699870.mp3,It is reputedly haunted.
.\data\Client6\clips\common_voice_en_42699874.mp3,His request was granted and will face Satoshi Kojima at this event.
.\data\Client6\clips\common_voice_en_42699892.mp3,That was characteristic of him all his life.
.\data\Client6\clips\common_voice_en_42699893.mp3,His church brought Clarke into personal contact with Newton.
.\data\Client6\clips\common_voice_en_42699894.mp3,No man was suffered to cross his legs or clasp his hands.
.\data\Client6\clips\common_voice_en_42699910.mp3,"The term ""Angry theatre"" was coined by critic John Russell Taylor."
.\data\Client6\clips\common_voice_en_42699911.mp3,Monoporeia feeds on phytoplankton and decomposed organic matter sinking onto the bottom.
.\data\Client6\clips\common_voice_en_42699912.mp3,"See fanzine, fanspeak."
.\data\Client6\clips\common_voice_en_42699913.mp3,"He wrote several texts on international law, politics, and international relations."
.\data\Client6\clips\common_voice_en_42699914.mp3,"The little cuckoo makes harsh ""chek"" and ""kak"" calls."
.\data\Client6\clips\common_voice_en_42699929.mp3,Both Waratton and Drogo were mayors of the palaces.
.\data\Client6\clips\common_voice_en_42699930.mp3,It is usually played with curved sticks.
.\data\Client6\clips\common_voice_en_42699931.mp3,Many of these shops survive.
.\data\Client6\clips\common_voice_en_42699932.mp3,They are shown facing each other.
.\data\Client6\clips\common_voice_en_42699933.mp3,"Finnian's sister, Saint Regnach, was Abbess of Kilreynagh, near the present town of Banagher."
.\data\Client6\clips\common_voice_en_42700013.mp3,The fear of Russia finally resulted in a German occupation of the islands.
.\data\Client6\clips\common_voice_en_42700014.mp3,Samyukt Kisan Morcha would now like to clarify strongly.
.\data\Client6\clips\common_voice_en_42700030.mp3,"Bernardo Gui also figures in the novel, as do Dolcino's papers."
.\data\Client6\clips\common_voice_en_42700077.mp3,"First, criticism has been made of the use of ""celebrity"" panelists."
.\data\Client6\clips\common_voice_en_42700078.mp3,It saw the election of Scott Smith.
.\data\Client6\clips\common_voice_en_42700079.mp3,Her family was very affluent and influential.
.\data\Client6\clips\common_voice_en_42700080.mp3,He was educated at Alma College and Bowling Green State University.
.\data\Client6\clips\common_voice_en_42700081.mp3,"However, a community uproar led to the scrapping of the plans."
.\data\Client6\clips\common_voice_en_42700087.mp3,He died in Brandon and was buried in Boissevain.
.\data\Client6\clips\common_voice_en_42700088.mp3,Another important theory of aggression in world science is the frustration-aggression theory.
.\data\Client6\clips\common_voice_en_42700089.mp3,"Nabokov claimed that Garnett's translations were dry and flat, and always unbearably demure."
.\data\Client6\clips\common_voice_en_42700090.mp3,The Western Australian towns of Broome and Broomehill are named after him.
.\data\Client6\clips\common_voice_en_42700091.mp3,Brasillach wrote both fiction and non-fiction.
.\data\Client6\clips\common_voice_en_42700096.mp3,The men both improved upon their scores and ranks from four years before.
.\data\Client6\clips\common_voice_en_42700097.mp3,Bevan was known for his heavy powerhouse drumming during this tour.
.\data\Client6\clips\common_voice_en_42700098.mp3,Aschaffenburg is also home to the Aschaffenburg Mohawks Baseball and Softball team.
.\data\Client6\clips\common_voice_en_42700099.mp3,The unusually long crankshaft was supported by nine main bearings to prevent torsional vibration.
.\data\Client6\clips\common_voice_en_42700100.mp3,The tower dates from ca.
.\data\Client6\clips\common_voice_en_42700101.mp3,Alberta has always been an export-oriented economy.
.\data\Client6\clips\common_voice_en_42700102.mp3,The dry climate of Pike National Forest makes it prime wildfire territory.
.\data\Client6\clips\common_voice_en_42700103.mp3,"Seeds, flour, and teas are generally safe when consumed in normal amounts."
.\data\Client6\clips\common_voice_en_42700104.mp3,"The name of the company was """"Ing."
.\data\Client6\clips\common_voice_en_42700105.mp3,You will be visited by all sorts of bad luck during the year.
.\data\Client6\clips\common_voice_en_42700118.mp3,Sherwood also adopted neglected or orphaned children from the camp.
.\data\Client6\clips\common_voice_en_42700120.mp3,"The Director, Defense Information Systems Agency also heads the Joint Task Force-Global Network Operations."
.\data\Client6\clips\common_voice_en_42700121.mp3,A jungle garden located at Penjerrick Garden is open to visitors on certain days.
.\data\Client6\clips\common_voice_en_42700123.mp3,"Andrea Township was named for Andrea Heider, the wife of an early settler."
.\data\Client6\clips\common_voice_en_42700124.mp3,"Two popular mods for Elden Ring are ""Seamless Co-op"" and ""Randomizer""."
.\data\Client6\clips\common_voice_en_42700131.mp3,"To achieve success, a person needs to set a personal goal."
.\data\Client6\clips\common_voice_en_42700133.mp3,Its county seat is Oshkosh.
.\data\Client6\clips\common_voice_en_42700134.mp3,The Fontana Dam site previously hosted a narrow gauge funicular railway for tourists.
.\data\Client6\clips\common_voice_en_42700136.mp3,"This bass was built as a tribute to Verdine's late brother, Maurice White."
.\data\Client6\clips\common_voice_en_42700137.mp3,Workers then tramped on the mud while straw was added to solidify the mold.
.\data\Client6\clips\common_voice_en_42701117.mp3,A and a comic-book series based on the film soon followed.
.\data\Client6\clips\common_voice_en_42701118.mp3,"Right now, Liam is sitting with the owner of the inn."
.\data\Client6\clips\common_voice_en_42701119.mp3,A film version was released alongside the album.
.\data\Client6\clips\common_voice_en_42701120.mp3,"Amiable and ""affable"" specifically suggest a pleasant and friendly disposition."
.\data\Client6\clips\common_voice_en_42701121.mp3,"This medication, combined with his alcohol use resulted in severe liver damage."
.\data\Client6\clips\common_voice_en_42701132.mp3,Pent Valley Technology College is one of the main secondary schools in Shepway.
.\data\Client6\clips\common_voice_en_42701133.mp3,Other notable triangle players include English folk singer Norma Waterson.
.\data\Client6\clips\common_voice_en_42701134.mp3,Doherty cites Buddy Miles as his main influence.
.\data\Client6\clips\common_voice_en_42701135.mp3,The slaves proceeded to his house where they killed his wife and children.
.\data\Client6\clips\common_voice_en_42701136.mp3,Mining interests also had a presence in the canyon in this period.
.\data\Client6\clips\common_voice_en_42703213.mp3,To the north lies Peary Channel.
.\data\Client6\clips\common_voice_en_42703214.mp3,"At Bridgend, the Barry bay was relaid and a new platform face built."
.\data\Client6\clips\common_voice_en_42703215.mp3,"The company's portfolio of brands also includes Ektelon, Viking and Battle."
.\data\Client6\clips\common_voice_en_42703216.mp3,Nevers' childhood friend Ole Haugsrud owned the Eskimos.
.\data\Client6\clips\common_voice_en_42703217.mp3,The Russian state attempted to suppress the nihilist movement.
.\data\Client6\clips\common_voice_en_42703599.mp3,It is now open to tourists.
.\data\Client6\clips\common_voice_en_42703600.mp3,Defensive armament consisted of a Browning machine gun for the rear gunner.
.\data\Client6\clips\common_voice_en_42703601.mp3,"His grandfather, John Corry Wilson Daly, was the first mayor of Stratford."
.\data\Client6\clips\common_voice_en_42703602.mp3,Deficiencies in certain proteins leads to disease; protein names are associated with the disease.
.\data\Client6\clips\common_voice_en_42703603.mp3,Staying neutral has a lot of benefits.
.\data\Client6\clips\common_voice_en_42703813.mp3,So get on my back and we will make the attempt.
.\data\Client6\clips\common_voice_en_42703814.mp3,One of the longstanding traditions at the college involves the Sabrina Statue.
.\data\Client6\clips\common_voice_en_42706042.mp3,Racing Hall of Fame inductee John Madden.
.\data\Client6\clips\common_voice_en_42706043.mp3,His paternal grandparents were Emmanuel Goodhart and Christiana Burford Goodhart.
.\data\Client6\clips\common_voice_en_42706049.mp3,The essential English leadership secret does not depend on particular intelligence.
.\data\Client6\clips\common_voice_en_42706050.mp3,"However, she lived much of her life in Muncie, Indiana and Indianapolis."
.\data\Client6\clips\common_voice_en_42706051.mp3,Theodore Zinck's was a bar in downtown Ithaca that has since closed.
.\data\Client6\clips\common_voice_en_42706052.mp3,It was the first federal ministry formed by the Australian Labor Party.
.\data\Client6\clips\common_voice_en_42706053.mp3,"Over many years, Millicent had backed countless campaigns; which were not all successful."
.\data\Client6\clips\common_voice_en_42706054.mp3,These dishes are made with love and are enjoyed by everyone.
.\data\Client6\clips\common_voice_en_42706056.mp3,"They did not engage in extensive agrarian agriculture, relying instead more heavily on aquaculture."
.\data\Client6\clips\common_voice_en_42706057.mp3,A show for all the couch.
.\data\Client6\clips\common_voice_en_42706058.mp3,"In French, as in English, most adverbs are derived from adjectives."
.\data\Client6\clips\common_voice_en_42706118.mp3,The update has markedly improved the performance and stability of the system.
.\data\Client6\clips\common_voice_en_42706119.mp3,That is the emergency stop switch.
.\data\Client6\clips\common_voice_en_42706120.mp3,A small portion of the city extends into nearby Washington County.
.\data\Client6\clips\common_voice_en_42706121.mp3,The site can be accessed by boat charter from the Fontana Marina.
.\data\Client6\clips\common_voice_en_42706122.mp3,Pufendorf is seen as an important precursor of Enlightenment in Germany.
.\data\Client6\clips\common_voice_en_42706133.mp3,"Immediately inside the gates is the large and ornate ""Gaston's Tomb""."
.\data\Client6\clips\common_voice_en_42706134.mp3,Retiring from imperial service he taught many disciplines.
.\data\Client6\clips\common_voice_en_42706135.mp3,He must never go near that willow bush again.
.\data\Client6\clips\common_voice_en_42706136.mp3,"The widow rocked herself to and fro, and wrung her hands."
.\data\Client6\clips\common_voice_en_42706137.mp3,They were split into two groups of four: Group A and Group B.
.\data\Client6\clips\common_voice_en_42706138.mp3,"McMahon was born in Quebec City, Quebec."
.\data\Client6\clips\common_voice_en_42706139.mp3,"To promote investment in new housing stock, rent control laws often exempt new construction."
.\data\Client6\clips\common_voice_en_42706140.mp3,"It flows through Bromyard, and Bishops Frome."
.\data\Client6\clips\common_voice_en_42706141.mp3,They need not be Gorenstein or even Q-Gorenstein.
.\data\Client6\clips\common_voice_en_42706142.mp3,"Shortly after establishment, the spelling was changed to ""Fusilier"", as in Sherbrooke Fusilier Regiment."
.\data\Client6\clips\common_voice_en_42706143.mp3,It is one story and faces west.
.\data\Client6\clips\common_voice_en_42706144.mp3,Martin ended up being a popular host on the show.
.\data\Client6\clips\common_voice_en_42706145.mp3,"The plaintiff claimed that Gallagher and Shean's act was ""unique and irreplaceable""."
.\data\Client6\clips\common_voice_en_42706146.mp3,The routines handle both real and complex matrices in both single and double precision.
.\data\Client6\clips\common_voice_en_42706147.mp3,There are two common ways to define the limit of sequences of sets.
.\data\Client6\clips\common_voice_en_42706148.mp3,Meat products contain both saturated and unsaturated fats.
.\data\Client6\clips\common_voice_en_42706149.mp3,I know how great it seems.
.\data\Client6\clips\common_voice_en_42706150.mp3,He holds the North American record for Grand Prix and Derby wins.
.\data\Client6\clips\common_voice_en_42706151.mp3,But where is the use?
.\data\Client6\clips\common_voice_en_42706152.mp3,He later completed his degree in History and Philosophy at Delhi University.
.\data\Client6\clips\common_voice_en_42706153.mp3,"The Maronites, however, are the dominant Christian group in the valley."
.\data\Client6\clips\common_voice_en_42706154.mp3,Shutting down these key industries would severely cripple the enemy's war effort.
.\data\Client6\clips\common_voice_en_42706155.mp3,A similar worship in stones is known in Crete.
.\data\Client6\clips\common_voice_en_42706156.mp3,He was buried in Greyfriars churchyard.
.\data\Client6\clips\common_voice_en_42706157.mp3,"The ship visited ports in the Philippines, Japan, Singapore, and Hong Kong."
.\data\Client6\clips\common_voice_en_42706158.mp3,The park is located in the eastern Pieniny Mountains on the border with Poland.
.\data\Client6\clips\common_voice_en_42706161.mp3,All these towns have border crossings.
.\data\Client6\clips\common_voice_en_42706162.mp3,A new science building is under construction at the Grayslake campus.
.\data\Client6\clips\common_voice_en_42706163.mp3,He became Limoges most famous enamel artist.
.\data\Client6\clips\common_voice_en_42706164.mp3,The general definition in higher dimensions is due to Hirzebruch.
.\data\Client6\clips\common_voice_en_42706165.mp3,Common snipe and curlew are among the waders which breed in the fen.
.\data\Client6\clips\common_voice_en_42706166.mp3,It is a maritime ballad about a disaster at sea.
.\data\Client6\clips\common_voice_en_42706167.mp3,"After the release, some volunteers started working on the game code."
.\data\Client6\clips\common_voice_en_42706168.mp3,This automation has led to faster production times and reduced errors.
.\data\Client6\clips\common_voice_en_42706170.mp3,"Lance was not wearing his, and dies of asphyxiation."
.\data\Client6\clips\common_voice_en_42706171.mp3,"A longer, novel form was published, based on the film."
.\data\Client6\clips\common_voice_en_42706172.mp3,"Richman starred in the penultimate filmed episode of ""The Twilight Zone"", called ""The Fear""."
.\data\Client6\clips\common_voice_en_42706173.mp3,Marc Summers advised on production as an executive consultant.
.\data\Client6\clips\common_voice_en_42706174.mp3,Multiple storefronts are located on the first floor.
.\data\Client6\clips\common_voice_en_42706175.mp3,The parishes became part of the borough of Milton Keynes.
.\data\Client6\clips\common_voice_en_42706176.mp3,"Landrieu is married to Cheryl P. Landrieu, also an attorney."
.\data\Client6\clips\common_voice_en_42706177.mp3,These battalions would dig in north and north-west of Arnhem.
.\data\Client6\clips\common_voice_en_42706178.mp3,The Desperate Bicycles were a group of amateur musicians who remained determinedly independent.
.\data\Client6\clips\common_voice_en_42706179.mp3,Karmazin also has a no-contest against former title contender Jason Papillion.
.\data\Client6\clips\common_voice_en_42706180.mp3,The song was also sung by Ivri Lider.
.\data\Client6\clips\common_voice_en_42706182.mp3,This was the largest locomotive used on these lines.
.\data\Client6\clips\common_voice_en_42706183.mp3,Lehmkuhl became the first pastor of Omaruru.
.\data\Client6\clips\common_voice_en_42706184.mp3,Hibbing Technical College also was created to serve the Hibbing area.
.\data\Client6\clips\common_voice_en_42706185.mp3,He later promoted produce transportation for the Reading Railroad.
.\data\Client6\clips\common_voice_en_42706186.mp3,This creates unique banding patterns on the chromosomes.
.\data\Client6\clips\common_voice_en_42706187.mp3,"Though he began teaching at the University of Maryland, he did continue painting."
.\data\Client6\clips\common_voice_en_42706188.mp3,A cluster of small craters lie across the south-southwest rim and inner wall.
.\data\Client6\clips\common_voice_en_42706189.mp3,"There is also a Minturno social club in the Woodbridge section of Toronto, Canada."
.\data\Client6\clips\common_voice_en_42706190.mp3,Galli-Curci was a student of the Indian meditation and yoga teacher Paramahansa Yogananda.
.\data\Client6\clips\common_voice_en_42706191.mp3,The region was previously isolated from most travelers and other communities.
.\data\Client6\clips\common_voice_en_42706192.mp3,The widemouth blindcat is a vulnerable species; it is threatened by groundwater pollution.
.\data\Client6\clips\common_voice_en_42706193.mp3,The Welsh Office was created to execute government policy in Wales.
.\data\Client6\clips\common_voice_en_42706194.mp3,Somebody's been making free here!
.\data\Client6\clips\common_voice_en_42706195.mp3,Langhammars was the setting for Ingmar Bergman's film Through a Glass Darkly.
.\data\Client6\clips\common_voice_en_42706196.mp3,He is the oldest brother of his sister Galina and his brother Sergey.
.\data\Client6\clips\common_voice_en_42706197.mp3,He is buried in Clevedon cemetery.
.\data\Client6\clips\common_voice_en_42706198.mp3,The character inventory is suitable for transcribing modern Swedish and the local Dalecarlian dialect.
.\data\Client6\clips\common_voice_en_42706199.mp3,The correction fixes these errors for proper grammar and clarity.
.\data\Client6\clips\common_voice_en_42706200.mp3,This staggering fact ignited Linkin Park's interest in helping to find solutions.
.\data\Client6\clips\common_voice_en_42706201.mp3,Edwards was a pioneer of the radio serial in Australia.
.\data\Client6\clips\common_voice_en_42706203.mp3,It is the primary transportation hub in western Djibouti via highway.
.\data\Client6\clips\common_voice_en_42706204.mp3,But they did not find Zerzura itself.
.\data\Client6\clips\common_voice_en_42706205.mp3,By this time Andy has sobered up and is having second thoughts.
.\data\Client6\clips\common_voice_en_42706206.mp3,"Educated in the law, he soon entered public service."
.\data\Client6\clips\common_voice_en_42706207.mp3,"In immature birds, the head stripes are brownish."
.\data\Client6\clips\common_voice_en_42706208.mp3,"It was shut down by the police, and Scully was arrested and prosecuted."
.\data\Client6\clips\common_voice_en_42706209.mp3,Brunswick headed through the northern woods believing he could cut off Dumouriez.
.\data\Client6\clips\common_voice_en_42706210.mp3,A critical position taken at Kynikos was his shorting of Enron.
.\data\Client6\clips\common_voice_en_42706211.mp3,Schaeffler has expanded the company over the years.
.\data\Client6\clips\common_voice_en_42706212.mp3,The database provides public access to the Gladys English Collection.
.\data\Client6\clips\common_voice_en_42706213.mp3,The stadium was the first stadium in Australia to have movable seating.
.\data\Client6\clips\common_voice_en_42706214.mp3,Pie menus are unavailable as standard graphical control element in common commercial toolkits.
.\data\Client6\clips\common_voice_en_42706215.mp3,"Phillippe was born in New Castle, Delaware."
.\data\Client6\clips\common_voice_en_42706216.mp3,Harris later became a scout and consultant the next season.
.\data\Client6\clips\common_voice_en_42706217.mp3,The city lacked funds for major line extensions.
.\data\Client6\clips\common_voice_en_42706218.mp3,"Old English ""torr"" is from Latin ""turris"" via Old French ""tor""."
.\data\Client6\clips\common_voice_en_42706219.mp3,Pearce won and became champion for a fourth time.
.\data\Client6\clips\common_voice_en_42706220.mp3,In his lifetime he was often referred to as Anacreon Moore.
.\data\Client6\clips\common_voice_en_42706221.mp3,Both the helicopter and the ornithopter enjoyed some success as toys.
.\data\Client6\clips\common_voice_en_42706222.mp3,Revolutionary methods are being used in Boro paddy and potato cultivation.
.\data\Client6\clips\common_voice_en_42706223.mp3,"Thus, for all intents and purposes, Sinclair owns both stations."
.\data\Client6\clips\common_voice_en_42706224.mp3,"There are many local variations on this group dancing, including the following."
.\data\Client6\clips\common_voice_en_42706225.mp3,The historic Southeast Steam Plant is also nearby.
.\data\Client6\clips\common_voice_en_42706226.mp3,The object of the game is to survive numerous levels of attacking monsters.
.\data\Client6\clips\common_voice_en_42706232.mp3,Coly then moved on to Perugia.
.\data\Client6\clips\common_voice_en_42706233.mp3,"Shortly afterwards, LeFarbe went over to the Russians."
.\data\Client6\clips\common_voice_en_42706234.mp3,"He played guitar on Sarah Slean's song ""Lucky Me""."
.\data\Client6\clips\common_voice_en_42706235.mp3,"Marini lives in Northern California with his wife, Ellen Jamason, and daughter Serena."
.\data\Client6\clips\common_voice_en_42706236.mp3,Oyem is named after a large tree that grows around the town.
.\data\Client6\clips\common_voice_en_42706433.mp3,Parts of Meridiani Planum display layered features from orbit.
.\data\Client6\clips\common_voice_en_42706434.mp3,"Palliser's division therefore was badly mauled, having allowed itself to be attacked piecemeal."
.\data\Client6\clips\common_voice_en_42706435.mp3,She additionally leads writing workshops.
.\data\Client6\clips\common_voice_en_42706436.mp3,"Most sets were reused from ""Novo Mundo""."
.\data\Client6\clips\common_voice_en_42706437.mp3,There is evidence of another wall crossing the summit.
.\data\Client6\clips\common_voice_en_42706498.mp3,Borie made at least five European and Mediterranean cruises.
.\data\Client6\clips\common_voice_en_42706499.mp3,Many historic straight deckers have been converted to self-unloaders or retired from service.
.\data\Client6\clips\common_voice_en_42706500.mp3,"The bay is known for its many different whale, dolphins and bird species."
.\data\Client6\clips\common_voice_en_42706501.mp3,Private banks are not incorporated.
.\data\Client6\clips\common_voice_en_42706502.mp3,The division mostly fought against Chetniks and Germans in occupied Serbia.
.\data\Client6\clips\common_voice_en_42706503.mp3,Nisha lives in Chennai and has one daughter Tara Top-Teagarden.
.\data\Client6\clips\common_voice_en_42706504.mp3,A powerful source is intended to bring about compliance in the receiver.
.\data\Client6\clips\common_voice_en_42706505.mp3,One is so dreadfully under everybody's eyes.
.\data\Client6\clips\common_voice_en_42706506.mp3,"He also defeated the Ammonites, who paid him an immense annual tribute."
.\data\Client6\clips\common_voice_en_42706507.mp3,McKuen's translation is significantly different from the original Brel lyric.
.\data\Client6\clips\common_voice_en_42706508.mp3,"Adapted from the liner notes of ""The Whip""."
.\data\Client6\clips\common_voice_en_42706509.mp3,The tempo markings are in German and are generally slow and reflective.
.\data\Client6\clips\common_voice_en_42706511.mp3,The killings sparked a violent uprising.
.\data\Client6\clips\common_voice_en_42706512.mp3,"Unfortunately, many of Young's films from her early period with Vitagraph are now lost."
.\data\Client6\clips\common_voice_en_42706514.mp3,The county falls within the United States National Radio Quiet Zone.
.\data\Client6\clips\common_voice_en_42706515.mp3,Middleby also scored in the match.
